"","Species","SpecCode.x","Genus.x","SpeciesRefNo","Author","PicPreferredName","FamCode","GenCode","BodyShapeI","Source","TaxIssue","Fresh","Brack","Saltwater","DemersPelag","AirBreathing","Vulnerability","Length","LTypeMaxM","MaxLengthRef","PriceCateg","MSeines","MGillnets","MCastnets","MTraps","MSpears","MTrawls","MDredges","MLiftnets","MHooksLines","MOther","UsedforAquaculture","UsedasBait","Aquarium","GameFish","Dangerous","Electrogenic","GoogleImage","Comments","PD50","Emblematic","Entered","DateEntered","Modified","DateModified","SpecCode.y","Genus.y","Family","Order","Class","SuperClass","Phylum","AreaCode","StockCode","Status","FAO","Invasive","MaxLengthTL","Troph","TempPrefMin","TempPrefMean","TempPrefMax"
"194","Crystallogobius linearis",60,"Crystallogobius",5204,"(Düben, 1845)","Crlin_u3.jpg",405,7660,"elongated","R",0,0,0,1,"demersal","WaterAssumed",13.92,4.69999980926514,"SL",4696,NA,0,0,0,0,0,0,0,0,0,0,"never/rarely",NA,NA,0,"harmless","no special ability",1,"Benthic and free swimming (Ref. 92840). This occasionally territorial species occurs in coastal waters, over shell, sand, or mud bottoms; males bottom-living during breeding season.  Feed on zooplankton (Ref. 5204).  Spawning takes place when 1 year old.  Adults die afterwards.  Eggs are laid in the empty tube-worms and are guarded by the male (Ref. 35388).  Eggs are pear-shaped (Ref. 4696).",1,0,5,1990-10-17,65,2014-02-27,60,"Crystallogobius","Gobiidae","Gobiiformes","Teleostei","Osteichthyes","Chordata",37,70,"native","Mediterranean and Black Sea","No",5.73000001907349,3.40000009536743,6.8,9.8,14.3
"195","Ctenolabrus rupestris",61,"Ctenolabrus",3397,"(Linnaeus, 1758)","Ctrup_u5.jpg",362,6521,"fusiform / normal","O",0,0,0,1,"reef-associated","WaterAssumed",32.5,18,"TL",3397,"very high",0,0,0,0,0,0,0,0,0,0,"never/rarely","never/rarely","public aquariums",1,"harmless","no special ability",1,"On rocky, weed-covered shores (1-50 m); larger specimens deeper than young.  Feed on bryozoans, crustaceans and gastropods (Ref. 3397).  Spawning takes place in summer when the male defends a territory (Ref. 35388).  Used in salmon culture as cleaner fish (Helmut Tethmeyer, pers. comm.).",1,0,2,1990-10-17,2,2008-01-10,61,"Ctenolabrus","Labridae","Eupercaria/misc","Teleostei","Osteichthyes","Chordata",37,71,"native","Mediterranean and Black Sea","No",18,3.57999992370605,8.7,10.4,15
"196","Cubiceps capensis",9888,"Cubiceps",6891,"(Smith, 1845)","Cucap_u0.jpg",422,1399,"fusiform / normal","R",0,0,0,1,"pelagic-oceanic","WaterAssumed",60.6,101,"TL",5951,"unknown",0,0,0,0,0,1,0,0,1,0,"never/rarely","never/rarely","never/rarely",0,"harmless","no special ability",1,"Oceanic, epipelagic or mesopelagic in tropical waters.  Feeds mainly on salps (Ref. 33689).  Occurs near the surface at night but depth at daytime is not known.  Excellent food fish.",0.500999987125397,0,1,1994-05-02,65,2013-07-15,9888,"Cubiceps","Nomeidae","Scombriformes","Teleostei","Osteichthyes","Chordata",37,10211,"native","Mediterranean and Black Sea","No",101,3.41000008583069,16.4,21.9,26.4
"197","Cubiceps gracilis",1710,"Cubiceps",6891,"(Lowe, 1843)","Cugra_u0.gif",422,1399,"fusiform / normal","R",0,0,0,1,"pelagic-oceanic","WaterAssumed",64.2,107,"TL",3397,"unknown",0,0,0,0,0,0,0,0,0,0,"never/rarely","never/rarely","never/rarely",0,"harmless","no special ability",1,"Oceanic, epipelagic or mesopelagic in warm and temperate waters.  Feeds mainly on salps (Ref. 33689).",0.500999987125397,0,5,1990-10-22,65,2013-07-15,1710,"Cubiceps","Nomeidae","Scombriformes","Teleostei","Osteichthyes","Chordata",37,1906,"native","Mediterranean and Black Sea","No",107,3.40000009536743,8.5,11.9,20
"198","Cyclichthys spilostylus",10305,"Cyclichthys",4423,"(Leis & Randall, 1982)","Cyspi_ul.jpg",449,9646,"short and / or deep","R",0,0,0,1,"reef-associated","WaterAssumed",24,34,"TL",9710,"unknown",0,0,0,0,0,0,0,0,0,0,"never/rarely","never/rarely",NA,0,"harmless","no special ability",1,"Found in coastal waters in the vicinity of reefs (Ref. 9680).  Lives in seagrass habitats and coastal slopes with sponges.  Active during the night (Ref. 48637).  Nocturnal and solitary (Ref. 9680), usually found under ledges during the day (Ref. 9710).  Juveniles pelagic (Ref. 30573).  Feeds on hard-shelled invertebrates (Ref. 9680).  Not usually marketed (Ref. 9680).",0.625,0,2,1994-05-25,97,2018-04-13,10305,"Cyclichthys","Diodontidae","Tetraodontiformes","Teleostei","Osteichthyes","Chordata",37,10627,"introduced","Mediterranean and Black Sea","Yes",34,3.46000003814697,22.1,27.8,29
"199","Cyclopterus lumpus",62,"Cyclopterus",4701,"Linnaeus, 1758","Cylum_u1.jpg",284,2057,"short and / or deep","R",0,0,0,1,"benthopelagic","WaterAssumed",46.79,61,"TL",58426,"low",0,1,0,0,0,1,0,0,1,1,"never/rarely","usually","never/rarely",0,"harmless","no special ability",1,"Basically solitary rather than a schooling fish.  They exhibit a homing instinct (Ref. 9737).  Adults inhabit rocky bottoms but may occur among floating seaweed.  They migrate considerable distances in an annual cycle between deeper waters in winter and shallower waters in summer (Ref. 26141).  Maximum depth reported at 868 m (Ref. 58426).  Epibenthic-pelagic (Ref. 58426).  Juveniles are found among algal clumps in bays and fjords moving offshore as they mature (Ref. 96431).  During the spawning season the males become reddish in color on the underside, whereas females turn blue-green.  Adults feed on ctenophores, medusas, small crustaceans, polychaetes, jelly fish and  small fishes.  Valued for their eggs, which make an inexpensive caviar (Ref. 9988).  Eaten in Nordic countries, marketed fresh or smoked.  Male flesh is most demanded and roe is sold fresh (Ref. 35388).",1,0,1,1990-10-17,2,2019-06-11,62,"Cyclopterus","Cyclopteridae","Perciformes/Cottoidei","Teleostei","Osteichthyes","Chordata",37,72,"questionable","Mediterranean and Black Sea","Yes",61,3.67000007629395,0.6,7.1,11.4
"200","Cyclothone braueri",1774,"Cyclothone",4769,"Jespersen & Tåning, 1926","Cybra_u0.jpg",88,9919,"elongated","R",0,0,0,1,"bathypelagic","WaterAssumed",10,2.59999990463257,"SL",5162,"unknown",0,0,0,0,0,0,0,0,0,0,"never/rarely","never/rarely","never/rarely",0,"harmless","no special ability",1,"Oceanic, precise depth range dependent upon developmental stage, latitude, season (Ref. 4769).  Generally horizontally oriented (Ref. 4769).  Feeds on small zooplankton, mostly copepods (Ref. 5162).  Sexually dimorphic with large females and small males (Ref. 9503).  Sex ratio vary with size groups but is about 1:1 around spawning. Length-frequency histograms are bimodal; has a two-year life cycle (Ref. 82363).",0.500100016593933,0,5,1990-10-24,113,2009-10-09,1774,"Cyclothone","Gonostomatidae","Stomiiformes","Teleostei","Osteichthyes","Chordata",37,1970,"native","Mediterranean and Black Sea","No",4.6399998664856,3.07999992370605,3.9,9.3,16.3
"201","Cyclothone microdon",1775,"Cyclothone",4463,"(Günther, 1878)","Cymic_u5.jpg",88,9919,"elongated","R",0,0,0,1,"bathypelagic","WaterAssumed",10,7.59999990463257,"TL",4925,"unknown",0,0,0,0,0,0,0,0,0,0,"never/rarely","never/rarely","never/rarely",0,"harmless","no special ability",1,"An oceanic, deep mesopelagic to bathypelagic species (Ref. 4769).  Precise depth range dependent upon developmental stage, latitude, season (Ref. 4769).  Doest not exhibit diel vertical migrations (Ref. 4769). A non-seasonal breeder with no recognizable age-cohorts (Ref. 82363).  Feeds mainly on copepods (Ref. 4769).",0.500100016593933,0,5,1990-10-24,1472,2009-10-09,1775,"Cyclothone","Gonostomatidae","Stomiiformes","Teleostei","Osteichthyes","Chordata",37,1971,"native","Mediterranean and Black Sea","No",7.59999990463257,3.03999996185303,1.8,3.2,8.2
"202","Cyclothone pygmaea",9989,"Cyclothone",4769,"Jespersen & Tåning, 1926","Cypyg_u0.jpg",88,9919,"elongated","R",0,0,0,1,"bathypelagic","WaterAssumed",10,2,"SL",4769,"unknown",0,0,0,0,0,0,0,0,0,0,"never/rarely","never/rarely","never/rarely",0,"harmless","no special ability",1,"Precise depth range dependent upon developmental stage and season.  Presumed dioecious, spawns during spring to autumn (Ref. 4769).",0.500100016593933,0,18,1994-05-05,14,2015-12-01,9989,"Cyclothone","Gonostomatidae","Stomiiformes","Teleostei","Osteichthyes","Chordata",37,10312,"endemic","Mediterranean and Black Sea","No",3.53999996185303,3.40000009536743,13.1,13.7,14
"203","Cynoglossus sinusarabici",16281,"Cynoglossus",5297,"(Chabanaud, 1931)","Cysin_u0.jpg",442,1404,"elongated","R",0,0,0,1,"demersal","WaterAssumed",10,17.1000003814697,"TL",94840,"very high",0,0,0,0,0,0,0,0,0,0,"never/rarely","never/rarely","never/rarely",0,"harmless","no special ability",1,"Not recorded from a depth of more than 135 m (Ref. 5297).",0.5,0,34,1996-01-17,65,2022-10-04,16281,"Cynoglossus","Cynoglossidae","Pleuronectiformes","Teleostei","Osteichthyes","Chordata",37,15056,"introduced","Mediterranean and Black Sea","Yes",17.1000003814697,3.35999989509583,24.3,27,29.3
"204","Cynoponticus ferox",4952,"Cynoponticus",4453,"Costa, 1846","Cyfer_u1.gif",504,4690,"eel-like","R",0,0,0,1,"demersal","WaterAssumed",90,200,"TL",4453,"unknown",0,0,0,0,0,0,0,0,1,0,"never/rarely","never/rarely","never/rarely",0,"harmless","no special ability",1,"Found on the shelf on sand and muddy bottoms (Ref. 2683).  Larger individuals caught mainly in 75-100 m depth (Ref. 26999).  Carnivorous.",0.625,0,2,1992-02-06,393,2010-04-05,4952,"Cynoponticus","Muraenesocidae","Anguilliformes","Teleostei","Osteichthyes","Chordata",37,5185,"native","Mediterranean and Black Sea","No",200,3.59999990463257,19.2,25.7,27.9
"205","Dactylopterus volitans",1021,"Dactylopterus",10782,"(Linnaeus, 1758)","Davol_u2.jpg",285,1858,"fusiform / normal","R",0,0,1,1,"reef-associated","WaterAssumed",36.51,50,"SL",6544,"unknown",1,0,0,0,0,1,0,0,1,1,"never/rarely","never/rarely","commercial",1,"harmless","no special ability",1,"Found on sand, mud or over rocks in sandy areas, exploring the bottom with the free part of the pectoral fins (Ref. 6544).  Feeds primarily on benthic crustaceans, especially crabs, clams and small fishes.  Neither anterolateral glandural groove nor venom gland is present (Ref. 57406).",1.0077999830246,0,1,1990-10-17,303,2007-04-26,1021,"Dactylopterus","Dactylopteridae","Dactylopteriformes","Teleostei","Osteichthyes","Chordata",37,1037,"native","Mediterranean and Black Sea","No",61,3.65000009536743,13.3,23.9,27.8
"206","Dagetichthys lusitanicus",8854,"Dagetichthys",80029,"(de Brito Capello, 1868)","Dalus_u0.jpg",441,9228,"short and / or deep","R",0,0,1,1,"demersal","WaterAssumed",30,40,"TL",6805,"very high",0,0,0,0,0,1,0,0,0,0,"never/rarely","never/rarely","never/rarely",0,"harmless","no special ability",1,"Found on sand or mud bottoms (Ref. 2683, 4710) in shallow waters, from the shore to 60 m (Ref. 4710). No information available on diet or reproduction (Ref. 4710). Maximum depth from Ref. 122917.",0.75,0,10,1994-03-02,2495,2020-09-28,8854,"Dagetichthys","Soleidae","Pleuronectiformes","Teleostei","Osteichthyes","Chordata",37,9175,"native","Mediterranean and Black Sea","Yes",40,3.5699999332428,23.2,26.6,28
"207","Dalatias licha",669,"Dalatias",247,"(Bonnaterre, 1788)","Dalic_m0.jpg",557,9547,"elongated","R",0,0,0,1,"bathydemersal","WaterAssumed",65.06,182,"TL",10717,"medium",0,0,0,0,0,0,0,0,1,0,"never/rarely","never/rarely","never/rarely",0,"harmless","electrosensing only",1,"Found on outer continental and insular shelves and slopes (Ref. 247).  Mainly found on or near the bottom but readily occurs well off the substrate (Ref. 247, 58302).  Often pelagic (Ref. 58302).  Found singly or in small schools (Ref. 6871).  Feeds mainly on deepwater bony fish, but also skates, other sharks (etmopterids in Ref. 123656), cephalopods and crustaceans (Ref. 5578).  This bioluminiscent shark (currently the largest luminous vertebrate) emit light ventrally to counterilluminate which might be used to illuminate the ocean floor while searching/hunting for prey; or to stealthily approach prey, using counterillumination camouflage, before striking fast when it is close enough (Ref. 123656). Ovoviviparous (Ref. 205), with 10-20 young born at 30-42 cm (Ref. 26346).  Used for its squalene liver oil, leather and meat, as well as for fishmeal (Ref. 6871).",1.00199997425079,0,23,1992-06-15,14,2021-03-03,669,"Dalatias","Dalatiidae","Squaliformes","Elasmobranchii","Chondrichthyes","Chordata",37,685,"native","Mediterranean and Black Sea","No",182,4.23000001907349,2.5,5.3,14.3
"208","Dalophis imberbis",1789,"Dalophis",3397,"(Delaroche, 1809)","Daimb_u1.jpg",66,225,"eel-like","O",0,0,0,1,"demersal","WaterAssumed",90,150,"TL",3397,"unknown",0,0,0,0,0,0,0,0,0,0,"never/rarely","never/rarely","never/rarely",0,"harmless","no special ability",1,"Burrows in sand or mud.",0.531199991703033,0,5,1990-10-25,18,2001-01-24,1789,"Dalophis","Ophichthidae","Anguilliformes","Teleostei","Osteichthyes","Chordata",37,1985,"native","Mediterranean and Black Sea","No",150,4.01999998092651,13.3,16.7,19.9
"209","Dasyatis chrysonota",25629,"Dasyatis",33465,"(Smith, 1828)","Dachr_u2.jpg",20,1943,"other","o",0,0,0,1,"demersal","WaterAssumed",68.88,75,"WD",36731,"low",0,0,0,0,0,0,0,0,0,0,"never/rarely","never/rarely","commercial",0,"harmless","no special ability",1,"Found in shallow bays, sheltered sandy beaches in summertime, moves to deeper waters during winter.  Feeds on bony fishes and crustaceans such as crabs, shrimps and mantis shrimps (Ref. 36731); including sea lice and marine worms (Ref. 114953).  Ovoviviparous (Ref. 50449).  Litters of 1-5 pups (Ref. 114953).  Often caught by shore anglers (Ref. 36731). It is parasitised by the monogenean <i>Dendromonocotyle citrosa</i> on the dorsal skin surface (Ref. 124058).",0.500199973583221,0,113,1996-11-28,2758,2021-05-05,25629,"Dasyatis","Dasyatidae","Myliobatiformes","Elasmobranchii","Chondrichthyes","Chordata",37,20225,"native","Mediterranean and Black Sea","No",123.5,3.8199999332428,17.2,24.8,26.7
"210","Dasyatis marmorata",8964,"Dasyatis",33465,"(Steindachner, 1892)","Dachr_u1.jpg",20,1943,"other","o",0,0,0,1,"demersal","WaterAssumed",44,60,"TL",4438,NA,0,1,0,0,0,1,0,0,0,0,"never/rarely","never/rarely","never/rarely",1,"harmless","no special ability",1,"Close inshore, found on sandy beaches and in shallow bays (Ref. 5578), sometimes near rocky reefs (Ref. 12951).  Found in deeper offshore areas during the winter season (Ref. 12951).  Feeds on crabs, mantis shrimps, amphipods, worms, and fishes (Ref. 12951).  Ovoviviparous (Ref. 50449).  Minimum depth reported from Ref. 4438.  Disc width measures 30 cm.  Its thorny, venomous hooks can cause painful injuries (Ref. 5377).",0.500199973583221,0,3,1994-03-05,1,2005-12-21,8964,"Dasyatis","Dasyatidae","Myliobatiformes","Elasmobranchii","Chondrichthyes","Chordata",37,5187,"native","Mediterranean and Black Sea","No",60,3.55999994277954,20.6,26.3,28.1
"211","Dasyatis pastinaca",2060,"Dasyatis",3261,"(Linnaeus, 1758)","Dapas_u0.jpg",20,1943,"other","O",0,0,1,1,"demersal","WaterAssumed",74.1,69.5,"WD",123699,"high",0,1,0,0,0,1,0,0,1,1,"never/rarely","never/rarely","never/rarely",1,"venomous","no special ability",1,"A coastal species, which enters coastal lagoons, shallow bays and estuaries (Ref. 81259). Found over sandy and muddy bottoms, sometimes near rocky reefs (Ref. 12951). Feeds on bottom fishes, crustaceans and mollusks. Ovoviviparous, gestation period about 4 months and 4-7 young are produced. Wings marketed smoked, dried-salted, and also used for fishmeal and oil. Harmful to shellfish banks; dangerous to bathers and fishers due to its poisonous spine. Barbed poison spine is a modified denticle that can be 35cm long, shed occasionally and replaced (Ref. 35388). Maximum reported width about 150 cm (Ref. 81259).",0.500199973583221,0,2,1991-01-18,65,2021-08-26,2060,"Dasyatis","Dasyatidae","Myliobatiformes","Elasmobranchii","Chondrichthyes","Chordata",37,2255,"native","Mediterranean and Black Sea","No",123.5,4.05000019073486,9.7,12.2,26.1
"212","Dasyatis tortonesei",9334,"Dasyatis",3169,"Capapé, 1975","Dator_u4.jpg",20,1943,"other","R",0,0,0,1,"demersal","WaterAssumed",74.1,80,"WD",3169,"low",0,0,0,0,0,0,0,0,0,0,"never/rarely","never/rarely","never/rarely",0,"harmless","no special ability",1,"Found over sandy and muddy bottoms.  Feeds on bottom-living invertebrates and fishes.  Ovoviviparous, gestation about 4 months and about 6 to 9 young are produced.",0.500199973583221,0,18,1994-04-14,1472,2008-02-11,9334,"Dasyatis","Dasyatidae","Myliobatiformes","Elasmobranchii","Chondrichthyes","Chordata",37,9656,"endemic","Mediterranean and Black Sea","No",123.5,4.01999998092651,13.3,14.9,16.1
"213","Decapterus macarellus",993,"Decapterus",9283,"(Cuvier, 1833)","Demac_u1.jpg",314,10590,"fusiform / normal","R",0,0,0,1,"pelagic-oceanic","WaterAssumed",22.51,46,"TL",55763,"medium",1,0,0,1,0,1,0,1,1,0,"never/rarely","usually","never/rarely",1,"reports of ciguatera poisoning","no special ability",1,"Adults prefer clear oceanic waters, frequently around islands (Ref. 5217).  Sometimes they are found near the surface, but generally caught between 40 and 200 m depth (Ref. 9283).  Pelagic (Ref. 58302).  Usually seen as fast moving schools along the reef edges near deep water (Ref. 48635, 26235).  They feed mainly on zooplankton (Ref. 9283).  Eggs are pelagic (Ref. 4233). Caught with purse seines and trawls (Ref. 9894). Marketed fresh and salted or dried (Ref. 9283).",0.500999987125397,0,2,1990-10-17,14,2019-01-24,993,"Decapterus","Carangidae","Carangiformes","Teleostei","Osteichthyes","Chordata",37,1009,"native","Mediterranean and Black Sea","No",46,3.96000003814697,13,21.9,27.9
"214","Decapterus punctatus",994,"Decapterus",7097,"(Cuvier, 1829)","Depun_u3.jpg",314,10590,"fusiform / normal","R",0,0,0,1,"reef-associated","WaterAssumed",33.63,30,"SL",3277,"medium",0,0,0,0,0,1,0,0,1,0,"never/rarely","usually","never/rarely",0,"harmless","no special ability",1,"Adults inhabit neritic waters, often near sandy beaches (Ref. 5217).  A shoaling species, generally  near the bottom (Ref. 27121).  They feed on planktonic invertebrates, primarily copepods, but also on gastropod larvae, ostracods and pteropods (Ref. 3277).  Spawning occurs well offshore year-round (Ref. 26938).  Eggs are pelagic (Ref. 4233).  A good food fish (Ref. 9626).  Caught commercially and used mainly for bait.",0.500999987125397,0,2,1990-10-17,303,2013-07-12,994,"Decapterus","Carangidae","Carangiformes","Teleostei","Osteichthyes","Chordata",37,1010,"native","Mediterranean and Black Sea","No",36.5999984741211,3.41000008583069,13.5,24.3,27.8
"215","Decapterus russelli",374,"Decapterus",7300,"(Rüppell, 1830)","Derus_u5.jpg",314,10590,"fusiform / normal","R",0,0,0,1,"benthopelagic","WaterAssumed",24.16,45,"TL",9987,"low",0,1,0,0,0,1,0,0,0,0,"never/rarely","occasionally","never/rarely",0,"harmless","no special ability",1,"Adults dwell from middle to benthic (Ref. 11230), forming large schools in deep water, but occasionally inshore in sheltered bays in small to large groups (Ref. 48635).  The most common <i>Decapterus</i> in coastal waters and on open banks of the Indian Ocean.  They feed mainly on smaller planktonic invertebrates.  Generally marketed fresh, may be dried or salted.  Also sold frozen and canned (Ref. 9987).",0.500999987125397,0,2,1990-10-17,2448,2021-12-01,374,"Decapterus","Carangidae","Carangiformes","Teleostei","Osteichthyes","Chordata",37,388,"introduced","Mediterranean and Black Sea","Yes",45,3.6800000667572,16.8,23.2,27.4
"216","Deltentosteus collonianus",56195,"Deltentosteus",4696,"(Risso, 1820)","Decol_u0.jpg",405,482,"fusiform / normal","R",0,0,0,1,"demersal","WaterAssumed",10,7,"TL",4696,"very high",0,0,0,0,0,0,0,0,0,0,"never/rarely","never/rarely","never/rarely",0,"harmless","no special ability",1,"Inshore, including sea-grass meadows; to about 120 m depth.",0.75,0,1,2000-04-27,303,2005-07-24,56195,"Deltentosteus","Gobiidae","Gobiiformes","Teleostei","Osteichthyes","Chordata",37,46268,"native","Mediterranean and Black Sea","No",7,3.54999995231628,NA,NA,NA
"217","Deltentosteus quadrimaculatus",16282,"Deltentosteus",5299,"(Valenciennes, 1837)","Dequa_u0.jpg",405,482,"elongated","R",0,0,0,1,"demersal","WaterAssumed",23.15,10.3000001907349,"TL",53342,"very high",0,0,0,0,0,0,0,0,0,0,"never/rarely","never/rarely","never/rarely",0,"harmless","no special ability",1,"Epibenthic over sand or muddy sand (Ref. 5299). Meiofauna feeder (Ref. 92840). Up to depth of 90 m (Ref. 5299) but collected up to depth of 333 m in the eastern Ionian Sea (Ref. 56504).  Minimum depth from Ref. 104982.",0.75,0,34,1996-01-17,65,2021-07-21,16282,"Deltentosteus","Gobiidae","Gobiiformes","Teleostei","Osteichthyes","Chordata",37,15055,"native","Mediterranean and Black Sea","No",10.3000001907349,3.09999990463257,13.3,15.2,18.2
"218","Dentex canariensis",4539,"Dentex",3688,"Steindachner, 1881","Decan_u0.gif",330,1038,"fusiform / normal","R",0,0,0,1,"demersal","WaterAssumed",60.05,100,"SL",4781,"medium",0,1,0,1,0,1,0,0,1,0,"never/rarely","never/rarely","never/rarely",0,"harmless","no special ability",1,"Live in small groups though large individuals may be solitary.  Inhabit inshore waters, close to the bottom on various substrates (specially rocky) to 150 m.  Adults feed on fish, crustaceans and cephalopods while the young feed on plankton (Ref. 4781).  Important food fish.",0.500100016593933,0,2,1991-07-19,65,2013-07-18,4539,"Dentex","Sparidae","Eupercaria/misc","Teleostei","Osteichthyes","Chordata",NA,NA,NA,NA,"Yes",122,3.59999990463257,12.8,14.5,16.1
"219","Dentex dentex",439,"Dentex",3688,"(Linnaeus, 1758)","Deden_u6.jpg",330,1038,"fusiform / normal","R",0,0,0,1,"benthopelagic","WaterAssumed",66.3,100,"TL",3397,"very high",0,1,0,1,0,1,0,0,1,0,"commercial","never/rarely","never/rarely",1,"harmless","no special ability",1,"Inhabit hard bottoms (rock or rubble) down to 200 m depth.  Usually found in shallow water less than 50 m deep (Ref. 9987).  Adults solitary; young gregarious (Ref. 12482).  Young fish caught with traps.  Feed on fish, mollusks and cephalopods.  Important food fish.  Marketed fresh or frozen (Ref. 9987).  Some attempts to culture this species have been successful.  Due to low market supply, the potential for selling these fish from aquaculture operations seems to be good (Ref. 9987).  A spear-fisherman cites a specimen caught in Greece (Corfu) with an overnight bottom-line about 1.60 m and 42 kg (Ref. 48271), but the identification cannot be verified.",0.500100016593933,0,5,1990-10-17,2,2008-01-08,439,"Dentex","Sparidae","Eupercaria/misc","Teleostei","Osteichthyes","Chordata",37,453,"native","Mediterranean and Black Sea","No",100,4.53000020980835,13.3,18.1,21.1
"220","Dentex gibbosus",4536,"Dentex",3688,"(Rafinesque, 1810)","Degib_u2.jpg",330,1038,"fusiform / normal","R",0,0,0,1,"benthopelagic","WaterAssumed",59.52,106,"FL",40637,"medium",0,1,0,1,0,1,0,0,1,0,"never/rarely","never/rarely",NA,1,"harmless","no special ability",1,"Occur on the shelf on rocky and rubble bottoms, as well as on sand around rocks.  The young are close to shore while the adults occur offshore in the vicinity of the continental slope.  Feed mainly on crustaceans, fish and cephalopods (Ref. 4781).  Minimum depth reported taken from Ref. 27000. Maximum published weight 15 kg (Ref. 5377) and reported 16.42 kg (Miguel Cañizares (pers.comm. 7/2019).",0.500100016593933,0,2,1991-07-18,14,2019-07-11,4536,"Dentex","Sparidae","Eupercaria/misc","Teleostei","Osteichthyes","Chordata",37,4721,"native","Mediterranean and Black Sea","No",117.660003662109,4.1399998664856,13,15.5,19.3
"221","Dentex macrophthalmus",438,"Dentex",3688,"(Bloch, 1791)","Demac_f0.jpg",330,1038,"fusiform / normal","R",0,0,0,1,"benthopelagic","WaterAssumed",54.3,65,"TL",3397,"very high",0,1,0,0,0,0,0,0,1,0,"never/rarely","never/rarely",NA,1,"harmless","no special ability",1,"Inhabit rocky or sandy bottoms; individuals descending to greater depths with growth.  The stocks migrate seasonally between the coast and deeper waters in accordance with local hydrographic conditions and their life cycle.  Feed mainly on fish and crustaceans; the young on plankton (Ref. 3688).  Gonochorists (Ref. 4781).",0.500100016593933,0,2,1990-10-17,2,2008-01-08,438,"Dentex","Sparidae","Eupercaria/misc","Teleostei","Osteichthyes","Chordata",37,452,"native","Mediterranean and Black Sea","No",65,3.45000004768372,13,14.9,16.8
"222","Dentex maroccanus",4538,"Dentex",3688,"Valenciennes, 1830","Demar_u1.jpg",330,1038,"fusiform / normal","R",0,0,0,1,"demersal","WaterAssumed",52.48,45,"TL",3397,"medium",0,0,0,0,0,1,0,0,1,1,"never/rarely","never/rarely",NA,1,"harmless","no special ability",1,"Inhabit various types of bottom but prefers gravel or rubble from 20 to about 500 m depth, abundance varying with depth according to the latitudes.  Feed mainly on crustaceans and fish but also takes mollusks (Ref. 4781).",0.500100016593933,0,2,1991-07-19,65,2013-07-18,4538,"Dentex","Sparidae","Eupercaria/misc","Teleostei","Osteichthyes","Chordata",37,4723,"native","Mediterranean and Black Sea","No",45,3.84999990463257,10,13.5,16.8
"223","Diaphus holti",1711,"Diaphus",4479,"Tåning, 1918","Dihol_uk.jpg",167,6596,"fusiform / normal","R",0,0,0,1,"bathypelagic","WaterAssumed",10,7,"SL",4479,"high",0,0,0,0,0,0,0,0,0,0,"never/rarely","never/rarely","never/rarely",0,"harmless","no special ability",1,"High-oceanic, found between 225-650 m during the day and between 40-275 m at night exhibiting size stratification with depth and with adult females below 450 m (Ref. 4479).  Depth range from 300-777 m in the eastern Ionian Sea (Ref. 56504).  Large juveniles, sub-adults and adults from the Mediterranean are known to be migratory (Ref. 4775).",0.5,0,5,1990-10-22,65,2022-05-30,1711,"Diaphus","Myctophidae","Myctophiformes","Teleostei","Osteichthyes","Chordata",37,1907,"native","Mediterranean and Black Sea","No",8.53999996185303,3.10999989509583,10.2,14.1,16.5
