"","Species","SpecCode.x","Genus.x","SpeciesRefNo","Author","PicPreferredName","FamCode","GenCode","BodyShapeI","Source","TaxIssue","Fresh","Brack","Saltwater","DemersPelag","AirBreathing","Vulnerability","Length","LTypeMaxM","MaxLengthRef","PriceCateg","MSeines","MGillnets","MCastnets","MTraps","MSpears","MTrawls","MDredges","MLiftnets","MHooksLines","MOther","UsedforAquaculture","UsedasBait","Aquarium","GameFish","Dangerous","Electrogenic","GoogleImage","Comments","PD50","Emblematic","Entered","DateEntered","Modified","DateModified","SpecCode.y","Genus.y","Family","Order","Class","SuperClass","Phylum","AreaCode","StockCode","Status","FAO","Invasive","MaxLengthTL","Troph","TempPrefMin","TempPrefMean","TempPrefMax"
"1","Ablennes hians",972,"Ablennes",9682,"(Valenciennes, 1846)","Abhia_m0.jpg",207,4864,"elongated","R",0,0,1,1,"reef-associated","WaterAssumed",39.61,140,"TL",40637,"high",1,1,1,0,1,0,0,0,1,0,"never/rarely","never/rarely","never/rarely",1,"harmless","no special ability",1,"Inhabits neritic and oceanic waters but more often found near islands (Ref. 5213).  Found in estuaries (Ref. 26340), and coastal rivers (Ref. 33587).  Sometimes forming large schools (Ref. 5217).  Feeds mainly on small fishes (Ref. 9279).  Oviparous (Ref. 205).  Eggs may be found attached to objects in the water by filaments on the egg's surface (Ref. 205). Since the jaws are frequently broken, the maximum length is given as body length excluding head and caudal fin.  Usually caught with the help of artificial lights (Ref. 9279).  Marketed  fresh and salted; smoked or frozen (Ref. 9987).  Market limited due to the green-colored flesh (Ref. 5217).  In females, only left gonad is developed, and in males the right gonad is small or absent (Ref. 26938).",1,0,1,1990-10-17,65,2015-04-14,972,"Ablennes","Belonidae","Beloniformes","Teleostei","Osteichthyes","Chordata",37,988,"native","Mediterranean and Black Sea","Yes",140,4.5,22.6,27.9,29.2
"2","Abudefduf hoefleri",11811,"Abudefduf",7247,"(Steindachner, 1881)","Absax_ua.jpg",350,7803,"short and / or deep","R",0,0,0,1,"reef-associated","WaterAssumed",10,20,"TL",27000,"unknown",0,0,0,0,0,0,0,0,0,0,"never/rarely","never/rarely",NA,0,"harmless","no special ability",1,"Littoral species that inhabit rocky reefs (Ref. 10797).  Oviparous, distinct pairing during breeding (Ref. 205).  Eggs are demersal and adhere to the substrate (Ref. 205).  Males guard and aerate the eggs (Ref. 205).",0.5,0,65,1994-07-21,2,2011-07-15,11811,"Abudefduf","Pomacentridae","Ovalentaria/misc","Teleostei","Osteichthyes","Chordata",NA,NA,NA,NA,"Yes",20,2.72000002861023,NA,NA,NA
"3","Abudefduf saxatilis",1119,"Abudefduf",7247,"(Linnaeus, 1758)","Absax_u7.jpg",350,7803,"short and / or deep","R",0,0,0,1,"reef-associated","WaterAssumed",12.9,22.8999996185303,"TL",26340,"unknown",1,0,1,1,0,0,0,0,1,0,"never/rarely","never/rarely","commercial",0,"harmless","no special ability",1,"Juveniles are common in tide pools while adults are found over shallow reef tops.  Adults frequently form large feeding aggregations of up to several hundred individuals.  Food items include algae, small crustaceans and fish, and various invertebrate larvae (Ref. 3139).  At Fernando de Noronha Archipelago, this species feeds on spinner dolphins’ feces and vomits. The offal feeding may be regarded as a simple behavioral shift from plankton feeding to drifting offal picking.  Also, juveniles may hold cleaning stations together with the doctorfish (<i>Acanthurus chirurgus</i>) and the blue tang (<i>Acanthurus coeruleus</i>) and graze algae as well as pick molted skin and parasites from green turtles (<i>Chelonia mydas </i>).  This behavior is preceded by a characteristic inspection usually followed by feeding nips on the turtles’ skin (head, limbs, and tail), as well as on the carapace. The most inspected and cleaned body parts are the flippers (Ref. 48727, 51385).  Adult males adopt a bluish ground color when guarding eggs.  Oviparous, distinct pairing during breeding (Ref. 205).  Eggs are demersal and adhere to the substrate (Ref. 205).  Attracted to divers who feed fish.  Marketed fresh (Ref. 3139).  Has been reared in captivity (Ref. 35420).",0.5,0,1,1990-10-17,65,2015-03-20,1119,"Abudefduf","Pomacentridae","Ovalentaria/misc","Teleostei","Osteichthyes","Chordata",37,1135,"introduced","Mediterranean and Black Sea","Yes",22.8999996185303,3.8199999332428,19.9,27.3,28.1
"4","Abudefduf sexfasciatus",5688,"Abudefduf",7247,"(Lacepède, 1801)","Absex_u0.jpg",350,7803,"short and / or deep","R",0,0,0,1,"reef-associated","WaterAssumed",10,19,"TL",90102,"unknown",0,0,0,0,0,0,0,0,0,0,"never/rarely","never/rarely","public aquariums",0,"harmless","no special ability",1,"Adults inhabit inshore and offshore coral or rocky reefs.  Also in shallow coastal reef flats or crests, usually where lots of tall soft corals or hydroid colonies are present (Ref. 48636).  Often found in groups feeding at midwater or tending nests among rocks and coral ledges (Ref. 90102).  Feed on zooplankton and algae and aggregates high in the water column (Ref. 9710).  Oviparous, distinct pairing during breeding (Ref. 205).  Eggs are demersal and adhere to the substrate (Ref. 205).  Males guard and aerate the eggs (Ref. 205).",0.5,0,14,1992-06-11,2310,2013-04-25,5688,"Abudefduf","Pomacentridae","Ovalentaria/misc","Teleostei","Osteichthyes","Chordata",NA,NA,NA,NA,"Yes",19,2.70000004768372,24.7,28.4,29.3
"5","Abudefduf vaigiensis",6630,"Abudefduf",7247,"(Quoy & Gaimard, 1825)","Abvai_ub.jpg",350,7803,"short and / or deep","R",0,0,0,1,"reef-associated","WaterAssumed",15.82,20,"TL",4391,"unknown",0,1,0,0,0,0,0,0,1,0,"never/rarely","never/rarely","commercial",0,"reports of ciguatera poisoning","no special ability",1,"Adults inhabit upper edge of outer reef slopes and inshore rocky reefs.  Juveniles associated with drifting seaweed (Ref. 12114, 12115).  Benthopelagic (Ref. 58302).  Feed on  zooplankton, benthic algae, and small invertebrates (Ref. 1602).  Often in aggregations (Ref. 9710) feeding at midwater or tending nests among rocks and coral ledges (Ref. 90102).  In large numbers at spawning sites that are timed with large tides that carry their pelagic offspring far offshore (Ref. 48636).  Oviparous, distinct pairing during breeding (Ref. 205).  Eggs are demersal and adhere to the substrate (Ref. 205).  Males guard and aerate the eggs (Ref. 205).",0.5,0,14,1992-11-27,2761,2021-11-19,6630,"Abudefduf","Pomacentridae","Ovalentaria/misc","Teleostei","Osteichthyes","Chordata",37,6950,"introduced","Mediterranean and Black Sea","Yes",20,2.5699999332428,21.9,28.2,29.3
"6","Acanthocybium solandri",89,"Acanthocybium",168,"(Cuvier, 1832)","Acsol_ua.jpg",416,369,"elongated","R",0,0,0,1,"pelagic-oceanic","WaterAssumed",46.13,250,"TL",30573,"very high",0,1,0,0,0,0,0,0,1,0,"never/rarely","never/rarely","never/rarely",1,"reports of ciguatera poisoning","no special ability",1,"An oceanic, epipelagic species frequently solitary or forming small loose aggregations rather than compact schools.  Feed on fishes and squids. Eggs and larvae are pelagic (Ref. 6769).   An important sport fish in some areas (Ref. 9340).  Marketed fresh, salted or spice-cured slices of meat; also frozen (Ref. 9987).  Flesh of very good quality (Ref. 9684). Minimum depth from Ref. 005227.",1,0,2,1990-10-17,949,2016-06-22,89,"Acanthocybium","Scombridae","Scombriformes","Teleostei","Osteichthyes","Chordata",37,104,"native","Mediterranean and Black Sea","No",250,4.26000022888184,18.2,24.7,27.6
"7","Acantholabrus palloni",7633,"Acantholabrus",5292,"(Risso, 1810)","Acpal_u3.jpg",362,516,"fusiform / normal","R",0,0,0,1,"reef-associated","WaterAssumed",15,25,"TL",5292,"very high",0,0,0,0,0,1,0,0,0,0,"never/rarely","never/rarely","never/rarely",0,"harmless","no special ability",1,"Adults inhabit coastal waters near rocky or sandy bottoms.  Feed on benthic invertebrates.  Solitary (Ref. 2683).  Oviparous, distinct pairing during breeding (Ref. 205).  Males build dish shaped nests and guard the eggs (Ref. 205).",1,0,18,1993-03-16,2,2011-07-28,7633,"Acantholabrus","Labridae","Eupercaria/misc","Teleostei","Osteichthyes","Chordata",37,7941,"native","Mediterranean and Black Sea","No",25,3.5,7.1,9.9,15.1
"8","Acanthopagrus bifasciatus",4543,"Acanthopagrus",95256,"(Forsskål, 1775)","Acbif_u0.jpg",330,6927,"fusiform / normal","O",0,0,1,1,"reef-associated","WaterAssumed",37.35,36.2000007629395,"SL",95256,"high",0,0,0,1,0,1,0,0,1,0,"never/rarely","never/rarely","never/rarely",0,"harmless","no special ability",1,"Occur in small groups.  (Ref. 9710).  Marketed fresh or dried.",0.5,0,2,1991-07-19,14,2014-03-17,4543,"Acanthopagrus","Sparidae","Eupercaria/misc","Teleostei","Osteichthyes","Chordata",37,4728,"introduced","Mediterranean and Black Sea","Yes",44.1599998474121,3.39000010490417,25,27.6,29.2
"9","Acanthostracion notacanthus",23370,"Acanthostracion",11227,"(Bleeker, 1863)","Acnot_u1.jpg",446,4119,"short and / or deep","R",0,0,0,1,"demersal","WaterAssumed",40,50,"TL",11227,"high",0,0,0,0,0,0,0,0,0,0,"never/rarely","never/rarely","never/rarely",0,"harmless","no special ability",1,"Found over rocks, rubble and sand (Ref. 5288), mainly around islands (Ref. 11227).",0.5625,0,34,1996-05-23,2291,2015-03-17,23370,"Acanthostracion","Ostraciidae","Tetraodontiformes","Teleostei","Osteichthyes","Chordata",37,18560,"native","Mediterranean and Black Sea","No",50,2.35999989509583,21.5,26.2,28
"10","Acanthostracion polygonium",4287,"Acanthostracion",35505,"Poey, 1876","Acpol_ub.jpg",446,4119,"short and / or deep","O",0,0,0,1,"reef-associated","WaterAssumed",40,50,"TL",36453,"high",1,0,0,1,0,0,0,0,0,0,"never/rarely","never/rarely","commercial",0,"reports of ciguatera poisoning","no special ability",1,"Occurs in clear water around coral reefs.  Feeds on sponges, alcyonarians, tunicates, and shrimp.  Uncommon and wary (Ref. 9710).  Consumed fresh, generally roasted (Ref. 5217).",0.5625,0,1,1991-05-02,2648,2022-04-09,4287,"Acanthostracion","Ostraciidae","Tetraodontiformes","Teleostei","Osteichthyes","Chordata",NA,NA,NA,NA,"Yes",50,2.02999997138977,21.4,25.9,28
"11","Acanthostracion quadricornis",92,"Acanthostracion",3141,"(Linnaeus, 1758)","Acqua_u4.jpg",446,4119,"short and / or deep","R",0,0,0,1,"reef-associated","WaterAssumed",42,55,"TL",6937,"high",1,0,0,0,0,0,0,0,0,0,"never/rarely","never/rarely","commercial",0,"reports of ciguatera poisoning","no special ability",1,"Found in shallow water down to about 80 m, mainly in seagrass beds (Ref. 3696).  Feeds on sessile invertebrates such as tunicates, gorgonians and anemones, as well as on slow-moving crustaceans, sponges (Ref. 3696), hermit crabs and marine plants (Ref. 13442).  Oviparous (Ref. 205).  Considered an excellent food fish; marketed fresh (Ref. 3696).",0.5625,0,2,1990-10-17,303,2005-06-29,92,"Acanthostracion","Ostraciidae","Tetraodontiformes","Teleostei","Osteichthyes","Chordata",37,106,"questionable","Mediterranean and Black Sea","No",55,2.6800000667572,22.3,25.4,28
"12","Acanthurus chirurgus",943,"Acanthurus",7251,"(Bloch, 1787)","Acchi_u2.jpg",412,9710,"short and / or deep","R",0,0,0,1,"reef-associated","WaterAssumed",22.98,39,"TL",47377,"medium",0,0,1,0,1,0,0,0,0,0,"never/rarely","never/rarely","commercial",0,"traumatogenic","no special ability",1,"Inhabits shallow reefs or rocky areas.  Found in loose aggregations (Ref. 9710).  Mainly diurnal.  Ingests sand when feeding on algae (Ref. 13442).  The spine on both sides of the caudal peduncle may inflict painful wounds (Ref. 5217).  Minimum depth reported from Ref. 27115.  Larvae are planktonic (Ref. 47377).  At Fernando de Noronha Archipelago in  southwestern Atlantic,  juveniles hold cleaning stations together with the blue tang (<i>Acanthurus coeruleus</i>) and sergeant major (<i>Abudefduf saxatilis</i>) and graze algae as well as pick molted skin and parasites from green turtles (<i>Chelonia mydas</i>).  This behavior is preceded by a characteristic inspection usually followed by feeding nips on the turtles’ skin (head, limbs, and tail), as well as on the carapace. The most inspected and cleaned body parts are the flippers (Ref. 51385).",0.5,0,2,1990-10-17,763,2004-06-21,943,"Acanthurus","Acanthuridae","Acanthuriformes","Teleostei","Osteichthyes","Chordata",NA,NA,NA,NA,"Yes",39,2.08999991416931,26.1,27.4,28
"13","Acanthurus coeruleus",944,"Acanthurus",7251,"Bloch & Schneider, 1801","Accoe_u0.jpg",412,9710,"short and / or deep","O",0,0,0,1,"reef-associated","WaterAssumed",58.55,39,"TL",36453,"medium",0,0,0,0,1,0,0,0,1,0,"never/rarely","occasionally","commercial",0,"traumatogenic","no special ability",1,"Inhabits coral reefs, inshore grassy or rocky areas.  Forms small groups (Ref. 26235).  Mainly diurnal.  Feeds entirely on algae (Ref. 5521).  At Fernando de Noronha Archipelago in  southwestern Atlantic,  juveniles hold cleaning stations together with the doctorfish (<i>Acanthurus chirurgus</i>) and sergeant major (<i>Abudefduf saxatilis</i>) and graze algae as well as pick molted skin and parasites from green turtles (<i>Chelonia mydas</i>).  This behavior is preceded by a characteristic inspection usually followed by feeding nips on the turtles’ skin (head, limbs, and tail), as well as on the carapace. The most inspected and cleaned body parts are the flippers (Ref. 51385).  Diurnal species (Ref. 3194). It forms resident spawning aggregations in late afternoon after high tide (Ref. 27825, 120681, 120682). The spine on both sides of the caudal peduncle may inflict painful wounds (Ref. 5217).  Marketed fresh.  Maximum depth reported taken from Ref. 127989.",0.5,0,2,1990-10-17,2762,2023-01-12,944,"Acanthurus","Acanthuridae","Acanthuriformes","Teleostei","Osteichthyes","Chordata",37,960,"introduced","Mediterranean and Black Sea","Yes",39,2.15000009536743,23.7,27.4,28.1
"14","Acanthurus monroviae",1800,"Acanthurus",7345,"Steindachner, 1876","Acmon_u5.jpg",412,9710,"short and / or deep","R",0,0,1,1,"demersal","WaterAssumed",41.96,45,"SL",3148,"medium",0,1,0,1,0,1,0,0,1,1,"never/rarely","never/rarely","commercial",0,"harmless","no special ability",1,"Coastal species found in the mouth of rivers and lagoons (Ref. 7345).  Found on rocky and coral bottoms (Ref. 2683).  Feeds on zooplankton, phytoplankton and detritus (Ref. 28587).  Minimum depth reported from Ref. 27115.",0.5,0,3,1990-10-25,34,1999-06-30,1800,"Acanthurus","Acanthuridae","Acanthuriformes","Teleostei","Osteichthyes","Chordata",37,1996,"questionable","Mediterranean and Black Sea","Yes",54.9000015258789,2.5,21.9,26.5,28
"15","Acanthurus sohal",4740,"Acanthurus",1920,"(Forsskål, 1775)","Acsoh_u0.jpg",412,9710,"short and / or deep","R",0,0,0,1,"reef-associated","WaterAssumed",30,40,"TL",30573,"medium",0,0,0,1,0,1,0,0,0,1,"never/rarely","never/rarely","commercial",0,"harmless","no special ability",1,"A common species found in seaward edges of reefs exposed to surge (Ref. 9710).  Aggressive and territorial (Ref. 9710).  Feeds on various kinds of algae, mainly <i>Sargassum</i>, and fine filamentous green algae.  Caught with nets (Ref. 30573); traps and occasionally by trawls (Ref. 68964).",0.5,0,14,1991-11-26,2291,2015-07-02,4740,"Acanthurus","Acanthuridae","Acanthuriformes","Teleostei","Osteichthyes","Chordata",NA,NA,NA,NA,"Yes",40,2,24.5,27,29.2
"16","Acipenser naccarii",2504,"Acipenser",59043,"Bonaparte, 1836","Acnac_u0.jpg",32,2154,"elongated","O",0,1,1,1,"demersal","WaterAssumed",86.02,200,"TL",3397,"unknown",0,0,0,0,0,0,0,0,0,0,"never/rarely","never/rarely","never/rarely",0,"harmless","electrosensing only",1,"Occurs in the sea close to shore and estuaries, not entering pure marine waters.  In freshwater, it inhabits large deep rivers (Ref.  59043).  A long-lived species which is found mainly over sand and mud.  Feeds on bottom-living invertebrates and small fishes.  Reproduction takes place from May to July.  Is threatened by habitat destruction, pollution and overfishing (Ref. 26100).  The flesh is used for food but the eggs are not consumed as caviar (Ref. 6866).",0.5,0,2,1991-03-19,1816,2013-04-17,2504,"Acipenser","Acipenseridae","Acipenseriformes","Chondrostei","Osteichthyes","Chordata",37,2698,"native","Mediterranean and Black Sea","No",200,3.34999990463257,14.7,17.4,18.2
"17","Acipenser stellatus",2065,"Acipenser",3397,"Pallas, 1771","Acste_ua.jpg",32,2154,"elongated","O",0,1,1,1,"demersal","WaterAssumed",84.74,250,"TL",98365,"unknown",0,0,0,0,0,0,0,0,0,0,"commercial","never/rarely","public aquariums",0,"harmless","electrosensing only",1,"At the sea, it occurs in coastal and estuarine zones and forages on the bottom mostly on clayey sand and intensively in the middle and upper water layers (Ref.  59043).  Found mainly near shore over sand and mud, stays at the bottom during the day and rises to the surface to feed at night.  Feeds mainly on fish, also mollusks, crustaceans and worms (Ref. 3193).  Spawns in strong-current habitats in main course of large and deep rivers, on stone or gravel bottom.  Spawning also takes place on flooded river banks and if gravel bottom is not available, on sand or sandy clay.  Juveniles stay in shallow riverine habitats during first summer (Ref. 59043).  One of the three most important species for caviar; also utilized fresh and frozen; eaten pan-fried, broiled and baked (Ref. 9988).  Overfishing at the sea for meat and caviar will soon cause extinction of the natural populations and their survival can only depend on stocking (Ref. 59043).",0.5,0,2,1991-01-18,2448,2022-06-27,2065,"Acipenser","Acipenseridae","Acipenseriformes","Chondrostei","Osteichthyes","Chordata",37,2260,"native","Mediterranean and Black Sea","No",250,3.49000000953674,7.6,13.1,15.9
"18","Acipenser sturio",2066,"Acipenser",3397,"Linnaeus, 1758","Acstu_u1.jpg",32,2154,"elongated","O",0,1,1,1,"demersal","WaterAssumed",88.08,600,"TL",59043,"unknown",0,1,0,0,0,0,0,0,1,0,"commercial","never/rarely","never/rarely",0,"harmless","electrosensing only",1,"Amphihaline and anadromous fish (Ref. 51346, 51439), frequenting littoral zones (Ref. 2163, 51439, 51442). A long-lived and slow-growing species (Ref. 9988). It lives the major part of his life in sea but enters rivers for reproduction (Ref. 30578, 51442). Found on various substrates, from sand to rocks (Ref. 51346). At the sea, it occurs in coastal and estuarine zones. In freshwaters, it inhabits estuaries and large rivers (Ref. 59043). Juveniles found both in estuaries and in the sea (Ref. 2163), they slowly adapt to saltwater (Ref. 89103) and usually spend around 2-3 years in river estuaries before moving to the sea (Ref. 40152), some may migrate to the sea during their first summer (Ref. 59043). Usually solitary. Feeds on crustaceans, mollusks, polychaete worms and small fish. Today most males only reach 100-150 cm length, females 130-215 cm (Ref. 59043, 89104). Utilized fresh and frozen, and also for caviar; eaten steamed, pan-fried, broiled, boiled, microwaved and baked (Ref. 9988). A threatened species, mainly due to bycatch, poaching, habitat degradation (spawning grounds, nursery areas) and physical obstacles to migration (Ref. 26160). 
",0.5,0,2,1991-01-18,2189,2012-01-25 22:15:38,2066,"Acipenser","Acipenseridae","Acipenseriformes","Chondrostei","Osteichthyes","Chordata",37,2261,"native","Mediterranean and Black Sea","No",600,3.50999999046326,7.3,11,18.8
"19","Aetomylaeus bovinus",5011,"Aetomylaeus",97392,"(Geoffroy Saint-Hilaire, 1817)","Ptbov_u1.jpg",22,7685,"other","R",0,0,1,1,"benthopelagic","WaterAssumed",82.5,NA,NA,85836,"medium",1,1,0,0,0,0,0,0,1,0,"never/rarely","never/rarely","never/rarely",1,"harmless","no special ability",1,"Found in coastal tropical and warm temperate waters, occasionally offshore.  Sometimes found in small groups (Ref. 5578).  Feed on bottom-living crustaceans and mollusks.  Ovoviviparous (Ref. 50449), aplacental (Ref. 57025).  Prized angling fish, often released (Ref. 5578).  Flesh highly esteemed (Ref. 3965).",0.507799983024597,0,2,1992-02-11,3,2015-11-23,5011,"Aetomylaeus","Myliobatidae","Myliobatiformes","Elasmobranchii","Chondrichthyes","Chordata",37,5245,"native","Mediterranean and Black Sea","No",137.5,3.78999996185303,13.7,17.2,24.5
"20","Aidablennius sphynx",25971,"Aidablennius",5981,"(Valenciennes, 1836)","Aisph_u2.jpg",392,3633,"elongated","O",0,0,0,1,"demersal","WaterAssumed",10,8,"TL",5981,"unknown",0,0,0,0,0,0,0,0,0,0,"never/rarely","never/rarely","never/rarely",0,"harmless","no special ability",1,"Found in very shallow, rocky, littoral zone, exposed to sunlight and surf; on horizontal, algae-covered terraces.  Feed on benthic invertebrates and algae (Ref. 5981).  Oviparous.  Eggs are demersal and adhesive (Ref. 205), and are attached to the substrate via a filamentous, adhesive pad or pedestal (Ref. 94114).  Males guard eggs in burrows (Ref. 5981).  Larvae are planktonic, often found in shallow, coastal waters (Ref. 94114).",1,0,34,1997-01-20,2,2014-01-20,25971,"Aidablennius","Blenniidae","Blenniiformes","Teleostei","Osteichthyes","Chordata",37,20482,"native","Mediterranean and Black Sea","No",8,2.09999990463257,17,18.8,19.9
"21","Alectis alexandrina",1888,"Alectis",7097,"(Geoffroy Saint-Hilaire, 1817)","Alale_u3.jpg",314,2433,"short and / or deep","R",0,0,0,1,"pelagic-neritic","WaterAssumed",60,100,"TL",27584,"high",1,0,0,0,0,1,0,0,1,0,"never/rarely","never/rarely","never/rarely",1,"harmless","no special ability",1,"Adults solitary in coastal water near the bottom to at least 50 m and strong swimmers (Ref. 7079, 57392).  Juveniles usually pelagic and drifting, sometimes occurring in brackish water (Ref. 4225, 57392).  Feed on squid and other fishes (Ref. 4233).  Eggs are pelagic (Ref. 4233).",0.625,0,2,1990-11-10,1307,2015-03-20 21:17:29,1888,"Alectis","Carangidae","Carangiformes","Teleostei","Osteichthyes","Chordata",37,2084,"native","Mediterranean and Black Sea","No",100,3.59999990463257,18.6,24.4,27.9
"22","Alepes djedaba",1889,"Alepes",3397,"(Forsskål, 1775)","Aldje_u2.jpg",314,1495,"fusiform / normal","O",0,0,0,1,"reef-associated","WaterAssumed",24.73,40,"TL",11228,"medium",0,0,0,1,0,1,0,0,0,0,"never/rarely","never/rarely","never/rarely",1,"harmless","no special ability",1,"Adults form large schools near inshore reefs (Ref. 30573).  Feed on shrimps, copepods, decapod larvae and other crustacean larvae and small fish (Ref. 5213, 90102).  Eggs are pelagic (Ref. 4233).  Often caught by ski-boat anglers in southern Africa (Ref. 12484).",0.531199991703033,0,2,1990-11-10,303,2013-09-24,1889,"Alepes","Carangidae","Carangiformes","Teleostei","Osteichthyes","Chordata",37,2085,"introduced","Mediterranean and Black Sea","Yes",40,3.3199999332428,24.7,28,29
"23","Alepisaurus ferox",99,"Alepisaurus",6011,"Lowe, 1833","Alfer_u0.jpg",171,7948,"elongated","R",0,0,0,1,"bathypelagic","WaterAssumed",90,215,"TL",7251,"unknown",0,0,0,0,0,1,0,0,1,0,"never/rarely","never/rarely","never/rarely",0,"harmless","no special ability",1,"Mainly inhabit tropical and subtropical waters; however, during the feeding period adults may migrate to the subarctic reaching as far north as Greenland, Iceland and the Bering Sea (Ref. 51887).  Epipelagic- and mesopelagic, from near the surface to below 1,000 m, sometimes approaching inshore waters (Ref. 6011).  Bathypelagic (Ref. 58302).  Mainly nocturnal.  Feeds on fishes, cephalopods, tunicates, and crustaceans (Ref. 6011).  Preyed upon by opah, sharks, albacore, yellowfin tuna, and fur seals (Ref. 6885).  Oviparous, with planktonic larvae (Ref. 36025).  Are synchronous hermaphrodites (Ref. 84733).  Occasionally consumed but of little importance due to its soft flesh (Ref. 5217).  The maximum weight given is for a 167 cm FL specimen (Ref. 42154).",1,0,1,1990-10-17,2,2010-07-30,99,"Alepisaurus","Alepisauridae","Aulopiformes","Teleostei","Osteichthyes","Chordata",37,113,"native","Mediterranean and Black Sea","No",215,4.03000020980835,4.7,8.9,14.6
"24","Alepocephalus rostratus",5071,"Alepocephalus",2719,"Risso, 1820","Alros_u0.jpg",86,960,"elongated","O",0,0,0,1,"bathydemersal","WaterAssumed",60.23,50,"SL",4460,"unknown",0,0,0,0,0,0,0,0,0,0,"never/rarely","never/rarely","never/rarely",0,"harmless","no special ability",1,"Found over soft bottoms (Ref. 4736).  Feeds on pelagic crustaceans like euphausiids, decapods and mysids (Ref. 27637).",0.5,0,2,1992-02-14,65,2016-01-13,5071,"Alepocephalus","Alepocephalidae","Alepocephaliformes","Teleostei","Osteichthyes","Chordata",37,5309,"native","Mediterranean and Black Sea","No",61,3.67000007629395,4.5,8.5,13.5
"25","Alopias superciliosus",2534,"Alopias",247,"Lowe, 1841","Alsup_u0.jpg",486,6653,"fusiform / normal","R",0,0,0,1,"pelagic-oceanic","WaterAssumed",84.92,487.984985351562,"TL",40637,"low",0,1,0,1,0,1,0,0,1,0,"never/rarely","never/rarely","never/rarely",1,"harmless","electrosensing only",1,"Occurs in coastal waters over continental shelves, sometimes close inshore in shallow waters, and on the high seas far from land (Ref. 247, 43278, 58302).  Oceanic, pelagic and near bottom at 1->500 m (Ref. 58302).  Depth range to at least 500 m (Ref. 247).  Feeds on pelagic fishes (lancetfishes, herring, mackerel and small billfishes (Ref. 43278)) and bottom fishes (hake (Ref. 43278)) and squids (Ref. 247).  Ovoviviparous, embryos feeding on yolk sac and other ova produced by the mother (Ref. 43278, 50449).  Stuns its prey with its long caudal fin (Ref. 247).  Utilized for human consumption, liver oil for vitamins, skin for leather, and fins for shark-fin soup (Ref. 247).  Marketed fresh and may be broiled, baked or grilled, but unsuitable for steaming, boiling or frying; meat may be salted and dried (Ref. 9987).  Also Ref. 33743.",0.75,0,23,1992-06-15,303,2012-02-22,2534,"Alopias","Alopiidae","Lamniformes","Elasmobranchii","Chondrichthyes","Chordata",37,2730,"native","Mediterranean and Black Sea","No",487.980010986328,4.46000003814697,19.2,27.1,29
