"","Species","SpecCode.x","Genus.x","SpeciesRefNo","Author","PicPreferredName","FamCode","GenCode","BodyShapeI","Source","TaxIssue","Fresh","Brack","Saltwater","DemersPelag","AirBreathing","Vulnerability","Length","LTypeMaxM","MaxLengthRef","PriceCateg","MSeines","MGillnets","MCastnets","MTraps","MSpears","MTrawls","MDredges","MLiftnets","MHooksLines","MOther","UsedforAquaculture","UsedasBait","Aquarium","GameFish","Dangerous","Electrogenic","GoogleImage","Comments","PD50","Emblematic","Entered","DateEntered","Modified","DateModified","SpecCode.y","Genus.y","Family","Order","Class","SuperClass","Phylum","AreaCode","StockCode","Status","FAO","Invasive","MaxLengthTL","Troph","TempPrefMin","TempPrefMean","TempPrefMax"
"617","Raja rondeleti",9303,"Raja",3167,"Bougis, 1959","Raron_u0.gif",19,1309,"other","R",1,0,0,1,"demersal","WaterAssumed",40,50,"TL",3167,"medium",0,0,0,0,0,0,0,0,0,0,"never/rarely","never/rarely","never/rarely",0,"harmless","weakly discharging",1,"Oviparous (Ref. 50449).  Eggs have horn-like projections on the shell (Ref. 205).",0.5,0,18,1994-04-13,14,2009-05-27,9303,"Raja","Rajidae","Rajiformes","Elasmobranchii","Chondrichthyes","Chordata",37,9625,"endemic","Mediterranean and Black Sea","No",50,3.5,13.1,13.9,15.2
"618","Raja undulata",7617,"Raja",27314,"Lacepède, 1802","Raund_u2.jpg",19,1309,"other","R",0,0,0,1,"demersal","WaterAssumed",66.2,100,"TL",4426,"medium",0,0,0,0,0,1,0,0,1,0,"never/rarely","never/rarely","never/rarely",0,"harmless","weakly discharging",1,"Found on sandy bottoms of shelf waters (Ref. 3167).  Feed on all kinds of bottom animals (Ref. 3167).  Oviparous.  Distinct pairing with embrace.  Young may tend to follow large objects, such as their mother (Ref. 205).  Eggs are oblong capsules with stiff pointed horns at the corners deposited in sandy or muddy flats (Ref. 205).  Egg capsules are 7.2-9.0 cm long and 4.2-5.2 cm wide (Ref. 41303 , 41251, 41304).",0.5,0,18,1993-03-13,2,2002-02-18,7617,"Raja","Rajidae","Rajiformes","Elasmobranchii","Chondrichthyes","Chordata",37,7921,"native","Mediterranean and Black Sea","No",100,3.5,9.8,13.2,17.1
"619","Ranzania laevis",1750,"Ranzania",6952,"(Pennant, 1776)","Ralae_u6.jpg",450,985,"short and / or deep","R",0,0,0,1,"pelagic-oceanic","WaterAssumed",60,100,"TL",26340,"unknown",0,1,0,0,0,1,0,0,0,1,"never/rarely","never/rarely",NA,0,"harmless","no special ability",1,"Oceanic (Ref. 2850), epipelagic (Ref. 2340), and generally solitary (Ref. 9317).  Feeds on planktonic crustaceans (Ref. 4424).",1.03120005130768,0,5,1990-10-24,949,2008-09-10,1750,"Ranzania","Molidae","Tetraodontiformes","Teleostei","Osteichthyes","Chordata",37,1946,"native","Mediterranean and Black Sea","No",100,3.66000008583069,14.7,23.9,27.9
"620","Rastrelliger kanagurta",111,"Rastrelliger",168,"(Cuvier, 1816)","Rakan_u9.jpg",416,1042,"fusiform / normal","R",0,0,0,1,"pelagic-neritic","WaterAssumed",14.71,36,NA,111654,"very high",0,1,0,1,0,1,0,1,0,1,"never/rarely","occasionally","never/rarely",1,"harmless","no special ability",1,"Adults occur in coastal bays, harbors and deep lagoons, usually in some turbid plankton-rich waters.  Form schools.  Feed on phytoplankton (diatoms) and small zooplankton (cladocerans, ostracods, larval polychaetes, etc.) (Ref. 9684).  Small groups were seen eating eggs of <i>Cheilio inermis</i> straight after spawning (Ref. 48637).  Adult individuals feed on macroplankton such as larval shrimps and fish.  Eggs and larvae are pelagic (Ref. 6769).  Generally marketed fresh, frozen, canned, dried-salted, and smoked; also made into fish sauce (Ref. 9684).",0.625,0,2,1990-10-17,65,2016-10-03,111,"Rastrelliger","Scombridae","Scombriformes","Teleostei","Osteichthyes","Chordata",37,125,"introduced","Mediterranean and Black Sea","Yes",30.25,3.19000005722046,23.7,27.3,28.3
"621","Regalecus glesne",3267,"Regalecus",3397,"Ascanius, 1772","Regle_u8.jpg",226,267,"eel-like","O",0,0,0,1,"pelagic-oceanic","WaterAssumed",90,800,"TL",92949,"high",0,0,0,0,0,0,0,0,1,1,"never/rarely","never/rarely","never/rarely",1,"harmless","no special ability",1,"Cool-water, anti-tropical distribution, at latitudes greater than 15° (Ref. 92949). Oceanic and can live at great depths (Ref. 2850), but occasionally cast up on beaches (Ref. 9563).  Large adults sometimes kill themselves by swimming out of the water onto beaches; occurrence of such strandings may be linked to certain areas, seasons or months and often in spates.  With a unique adaptation of self-amputation (autotomy) of the posterior part of the body past the vent which may involve only the caudal fin (or one to a few small adjacent vertebrae) or as far anterior as just before the abdomen; apparently occurs several times during its lifetime (serial autotomy) but do not damage any vital organs and are usually survived except in strandings.  All records over 1.5 m long have bodies shortened by autotomy and may exhibit a healed-over stump or ""terminus""; still, many  specimens found with fresh (with a ragged appearance very different from a healed termini) incomplete self-amputations of the posterior part of the body, notably not consistent with shark bites; the lost part is never regenerated.  Species of this <i>Regalecus</i> attain lengths of 7-8 meters and this is well established by documented specimens.  Oftentimes vertically suspended head-up in clear oceanic or inshore waters with the rays of the two dorsal fin crests usually extended vertically upwards while the pelvic fin rays may be horizontally spread outward and away from the body (Ref. 92949).  This is hypothesized to be a feeding stance that visually allows the fish to spot the silhouette of its potential prey against the skylight (Ref. 49905).  Feed on euphausiid crustaceans, small fishes and squid (Ref. 6738).  Toothless protrusile jaws work to suction krill-laden water into its oro-branchial cavity and retained in the gullet by the long, spiny and bristly gill rakers (Ref. 92949).  Occassionally associate in pairs (gender undocumented) but no record of group larger than three or of schooling behavior (Ref. 92949).  Spawning occurs between July and December and larvae are encountered near the surface (Ref. 9337).  Mature individuals spawn in the North Atlantic along the west coast of Florida and off the northern coast of America; in or near the Straits of Messina in the Mediterranean; in the South Pacific in the Catham Rise area of New Zealand and somewhere off the west coast of southern Australia (Ref. 92949).   In Guinness Book of Records as longest bony fish (Ref. 6472). Also caught with encircling nets and marketed fresh (Ref. 9337).  Reputed to be unpalatable because the flesh is tasteless or otherwise unappetizing (Ref. 92949).  Underwater footage shows them slowly swimming vertically, head up, with a stiff body, only undulating the dorsal fin, and with photophores on their appendages. The mouth can be protruded for capturing prey (RF, pers. comm. 2013).",0.875,1,1,1991-05-01,303,2020-10-31,3267,"Regalecus","Regalecidae","Lampriformes","Teleostei","Osteichthyes","Chordata",37,3463,"native","Mediterranean and Black Sea","No",800,3.20000004768372,11.2,23.9,28.9
"622","Remora australis",3545,"Remora",7300,"(Bennett, 1840)","Reaus_u0.jpg",313,847,"elongated","R",0,0,0,1,"pelagic-oceanic","WaterAssumed",50.4,76,"TL",2850,"high",0,0,0,0,0,0,0,0,0,0,"never/rarely","never/rarely","never/rarely",0,"harmless","no special ability",1,"Oceanic, mostly in warm seas.  Attaches itself only to whales and porpoises (Ref. 7251).  One adult couple was recorded attached to the same individual spinner dolphin for a period of about 3 months (Ref. 50801).  A common associate of spinner dolphins at Fernando de Noronha Archipelago, southeast Atlantic, where it occurs year-round.  Recorded feeding on spinner dolphins’ feces and vomits (Ref. 48727).",0.535199999809265,0,1,1991-05-01,65,2016-06-29,3545,"Remora","Echeneidae","Carangiformes","Teleostei","Osteichthyes","Chordata",37,3741,"stray","Mediterranean and Black Sea","No",76,3.51999998092651,14.1,23,27.5
"623","Remora brachyptera",3546,"Remora",7300,"(Lowe, 1839)","Rebra_u1.jpg",313,847,"elongated","R",0,0,0,1,"pelagic-oceanic","WaterAssumed",40,50,"TL",55763,"high",0,0,0,0,0,0,0,0,0,0,"never/rarely","never/rarely","never/rarely",0,"harmless","no special ability",1,"Found on the body and inside gill chamber of billfishes and swordfishes, rarely on any other fishes (Ref. 2850); also in the gill cavities and mouths of sharks (Ref. 5951).",0.535199999809265,0,1,1991-05-01,1472,2008-09-22,3546,"Remora","Echeneidae","Carangiformes","Teleostei","Osteichthyes","Chordata",37,3742,"native","Mediterranean and Black Sea","No",50,3.46000003814697,7.9,23.4,28.1
"624","Remora osteochir",3547,"Remora",7300,"(Cuvier, 1829)","Reost_u3.jpg",313,847,"elongated","R",0,0,0,1,"pelagic-oceanic","WaterAssumed",38.8,40,"SL",5288,NA,0,0,0,0,0,0,0,0,0,0,"never/rarely","never/rarely","never/rarely",0,"harmless","no special ability",1,"Oceanic species with a strong preference for marlins and sailfish as hosts, but may occasionally cling to other large fishes.  Attaches to the body or gill chamber of the host (Ref. 10791).  Oviparous.  Distinct pairing during breeding (Ref. 57896).",0.535199999809265,0,1,1991-05-01,2291,2015-04-29,3547,"Remora","Echeneidae","Carangiformes","Teleostei","Osteichthyes","Chordata",37,3743,"native","Mediterranean and Black Sea","No",48.7999992370605,3.5,17.3,25.9,28.2
"625","Remora remora",1751,"Remora",10791,"(Linnaeus, 1758)","Rerem_u2.jpg",313,847,"elongated","R",0,0,0,1,"reef-associated","WaterAssumed",54.56,86.4000015258789,"TL",26340,"high",0,0,0,0,0,0,0,0,1,0,"never/rarely","never/rarely","never/rarely",0,"harmless","no special ability",1,"Usually associated with sharks but also attaches itself to other large fishes, sea turtles and even ships (Ref. 2850, 58302); found in gill chambers, fins and body surface (Ref. 5951).  Sometimes free-swimming (Ref. 2850).  Younger individual is more active as parasite pickers (Ref. 26938).  Feeds on parasitic copepods (Ref. 35388).",0.535199999809265,0,5,1990-10-24,2291,2015-04-29,1751,"Remora","Echeneidae","Carangiformes","Teleostei","Osteichthyes","Chordata",37,1947,"native","Mediterranean and Black Sea","No",86.4000015258789,3.49000000953674,11.7,24.8,28.2
"626","Rhabdosargus haffara",8166,"Rhabdosargus",3507,"(Forsskål, 1775)","Rhhaf_u0.jpg",330,2270,"fusiform / normal","O",0,0,0,1,"reef-associated","WaterAssumed",25,35,"TL",30573,"very high",1,1,0,0,0,0,0,0,1,0,"never/rarely","never/rarely","never/rarely",0,"harmless","no special ability",1,"Inhabits shallow waters, mainly around coral reefs, and over sandy or mud-sandy bottoms (Ref. 30573).  Feeds on benthic invertebrates (Ref. 30573).  Consumed fresh.",0.515600025653839,0,10,1993-07-07,65,2013-07-18,8166,"Rhabdosargus","Sparidae","Eupercaria/misc","Teleostei","Osteichthyes","Chordata",37,8477,"introduced","Mediterranean and Black Sea","Yes",35,3.5,24.8,27.5,29.2
"627","Rhinobatos rhinobatos",5016,"Rhinobatos",2683,"(Linnaeus, 1758)","Rhrhi_u0.jpg",17,1540,"elongated","O",0,0,1,1,"demersal","WaterAssumed",65.69,185,"TL",127374,"low",0,1,0,0,0,0,0,0,1,1,"never/rarely","never/rarely","never/rarely",0,"harmless","electrosensing only",1,"Inhabits sandy and muddy bottoms, from the intertidal zone to about 100 m.  Sometimes near rocky reefs (Ref. 12951).  Slow swimming over bottom or partially buried.  Feeds on benthic invertebrates, mainly crustaceans and small fishes. Males mature at ca. 56 cm TL, females at ca. 64 cm TL; born at ca. 25 cm TL (Ref. 114953).  Ovoviviparous, one or two litters per year with 4-10 embryos.",0.5,0,2,1992-02-11,65,2022-10-04,5016,"Rhinobatos","Rhinobatidae","Rhinopristiformes","Elasmobranchii","Chondrichthyes","Chordata",37,5250,"native","Mediterranean and Black Sea","No",185,4.07999992370605,19.2,26.1,28
"628","Rhinoptera marginata",8976,"Rhinoptera",4441,"(Geoffroy Saint-Hilaire, 1817)","Rhmar_u0.gif",718,953,"other","R",0,0,0,1,"benthopelagic","WaterAssumed",86.35,200,"WD",6678,"medium",0,1,0,0,0,1,0,0,1,1,"never/rarely","never/rarely","never/rarely",0,"harmless","no special ability",1,"Found in tropical to warm temperate coastal waters, but absent from islands of western Pacific.  Often forming large groups swimming near the surface and quite destructive of commercial oyster and clam beds.  Feeds on bottom-living mollusks, crustaceans and fishes.  Seldom marketed.  Ovoviviparous, gestation period up to one year with 2-6 embryos produced.",0.503899991512299,0,3,1994-03-05,14,2019-08-19,8976,"Rhinoptera","Rhinopteridae","Myliobatiformes","Elasmobranchii","Chondrichthyes","Chordata",37,9297,"native","Mediterranean and Black Sea","No",143.910003662109,3.83999991416931,17.1,19.7,21.7
"629","Rhizoprionodon acutus",899,"Rhizoprionodon",244,"(Rüppell, 1837)","Rhacu_m2.jpg",11,2481,"fusiform / normal","R",0,1,1,1,"benthopelagic","WaterAssumed",60.97,175,"TL",12693,"medium",0,1,0,1,0,1,0,0,1,0,"never/rarely","never/rarely","never/rarely",1,"harmless","electrosensing only",1,"Found on continental shelves, often on sandy beaches and rarely in estuaries (Ref. 244).  Reported to enter freshwater and recorded several times from Cambodia as far upstream as the Great Lake (Ref. 12693).  Occurs near the surface in shallow waters (Ref. 12693).  Feeds mainly on small pelagic and benthic bony fishes, also cephalopods and other invertebrates (Ref. 244).  Viviparous (Ref. 50449).  Utilized fresh and possibly dried salted for human consumption and for fishmeal (Ref. 9997).  The 178 cm specimen recorded off Africa is possibly based on some other species (Ref. 9997).",0.507799983024597,0,23,1992-06-15,2,2004-01-27,899,"Rhizoprionodon","Carcharhinidae","Carcharhiniformes","Elasmobranchii","Chondrichthyes","Chordata",37,915,"questionable","Mediterranean and Black Sea","Yes",175,4.25,19.6,26.9,28.5
"630","Rhynchoconger trewavasae",57764,"Rhynchoconger",7446,"Ben-Tuvia, 1993","Rhtre_u0.jpg",62,4438,"eel-like","O",0,0,0,1,"bathydemersal","WaterAssumed",42.8,57,"TL",7446,"medium",0,0,0,1,0,0,0,0,0,0,"never/rarely","never/rarely","never/rarely",0,"harmless","no special ability",1,"Swims close to the bottom in zigzag movements.  Caught by traps and trammel nets (Ref. 7446).",0.507799983024597,0,14,2001-02-19,97,2005-12-07,57764,"Rhynchoconger","Congridae","Anguilliformes","Teleostei","Osteichthyes","Chordata",37,47287,"introduced","Mediterranean and Black Sea","Yes",57,3.91000008583069,NA,NA,NA
"631","Rhynchogadus hepaticus",1803,"Rhynchogadus",4774,"(Facciolà, 1884)","Rhhep_u0.jpg",180,10319,"fusiform / normal","R",0,0,0,1,"bathypelagic","WaterAssumed",10,10,"SL",4774,NA,0,0,0,0,0,0,0,0,0,0,"never/rarely","never/rarely","never/rarely",0,"harmless","no special ability",1,"Rare species of deep waters.",1,0,5,1990-10-25,65,2013-07-15,1803,"Rhynchogadus","Moridae","Gadiformes","Teleostei","Osteichthyes","Chordata",37,1999,"endemic","Mediterranean and Black Sea","No",12.1999998092651,3.27999997138977,NA,NA,NA
"632","Rostroraja alba",7613,"Rostroraja",27314,"(Lacepède, 1803)","Roalb_u0.jpg",19,4734,"other","R",0,0,0,1,"demersal","WaterAssumed",90,230,"TL",11284,"medium",0,0,0,0,0,1,0,0,1,1,"never/rarely","never/rarely","never/rarely",1,"traumatogenic","weakly discharging",1,"Inhabit shelf and slope waters (Ref. 4426).  Found on sand and rock-sand bottom (Ref. 6808).  A bottom-predator of bony fishes, other elasmobranchs, fish offal, crabs, shrimps, mysids, octopi, and cuttlefish (Ref. 5578).  Minimum depth reported taken from Ref. 4426.  Maximum length for female is 202 cm (Ref. 41333).  Oviparous.  Distinct pairing with embrace.  Young may tend to follow large objects, such as their mother (Ref. 205).  Eggs are oblong capsules with stiff pointed horns at the corners deposited in sandy or muddy flats (Ref. 205).  Egg capsules are 12.5-18.3 cm long and 10.0-13.9 cm wide (Ref. 41250).  About 55-156 eggs are produced per individual annually (Ref. 41250).",1,0,18,1993-03-13,393,2010-04-06,7613,"Rostroraja","Rajidae","Rajiformes","Elasmobranchii","Chondrichthyes","Chordata",37,7917,"native","Mediterranean and Black Sea","No",230,4.40999984741211,8.8,13.5,17.5
"633","Ruvettus pretiosus",1044,"Ruvettus",6181,"Cocco, 1833","Rupre_f0.jpg",414,1045,"elongated","R",0,0,0,1,"benthopelagic","WaterAssumed",90,300,"TL",5951,"medium",1,1,0,0,0,1,0,0,1,0,"never/rarely","never/rarely","never/rarely",1,"poisonous to eat","no special ability",1,"Usually over the continental shelf, sometimes in oceanic waters down to 800 m (Ref. 9302).  Usually solitary or in pairs near the bottom (Ref. 6181).  Migrates far offshore (Ref. 26139).  Pelagic (Ref. 5951).  Feeds on fish, crustaceans and squid (Ref. 6181).  The peculiar wooden 'palu' or <i>Ruvettus</i> hook is used to catch this species in south central Pacific (Ref. 6181).  The flesh is very oily, with purgative properties, if eaten much (Ref. 6181).  Marketed fresh and as fish cakes in Japan (Ref. 9302); also processed into fishmeal (Ref. 5217).  Maximum length reported to reach up to 2 m only (Heemstra, pers. comm. 03/03).",1,0,2,1990-10-17,2237,2023-01-11,1044,"Ruvettus","Gempylidae","Scombriformes","Teleostei","Osteichthyes","Chordata",37,1060,"native","Mediterranean and Black Sea","No",300,4.17999982833862,8.6,12.9,19
"634","Salaria basilisca",46339,"Salaria",5981,"(Valenciennes, 1836)","Sabas_f0.jpg",392,4760,"fusiform / normal","O",0,0,0,1,"demersal","FacultativeGenus",10,18,"TL",5981,"unknown",0,0,0,0,0,0,0,0,0,0,"never/rarely","never/rarely","never/rarely",0,"harmless","no special ability",1,"Adults occur among seagrass, sometimes on rocky bottoms.  Eggs produced by several females are guarded by male.  Individuals are first females then change to males (Ref. 5981).  Oviparous.  Eggs are demersal and adhesive (Ref. 205), and are attached to the substrate via a filamentous, adhesive pad or pedestal (Ref. 94114).  Larvae are planktonic, often found in shallow, coastal waters (Ref. 94114).",0.531199991703033,0,34,1998-02-15,2,2014-02-28,46339,"Salaria","Blenniidae","Blenniiformes","Teleostei","Osteichthyes","Chordata",37,39048,"endemic","Mediterranean and Black Sea","No",18,2,17.4,18.8,19.7
"635","Salaria pavo",1701,"Salaria",5981,"(Risso, 1810)","Sapav_u4.jpg",392,4760,"fusiform / normal","R",0,0,1,1,"demersal","Facultative",25.08,13,"TL",5981,"unknown",0,0,0,0,0,0,0,0,0,0,"never/rarely","never/rarely","never/rarely",0,"harmless","no special ability",1,"Adults occur in the intertidal zone and shallow bottoms, on rocks or sand between pebbles and vegetation (Ref. 5981).  Often in brackish waters down to 5 ppt (Ref. 5981).  Inhabit crevices or piddock holes, males remain in cavities above water-level during low tide (Ref. 5981).  Feed on benthic invertebrates, mainly mollusks, also algae (Ref. 5981).  Also ingest large amounts of aquatic insects and pupae (Ref. 94105).  Oviparous (Ref. 205).  Mature males adopt a passive role during courtship, rarely court females, do not defend nest territory, but provide parental care to eggs.  Sneaker males assume a female-like behavior in order to approach the nests of nesting males and parasitically fertilize the eggs (Ref. 94113).  Eggs are demersal and adhesive (Ref. 205).  Has been reared in captivity (Ref. 35421).",0.531199991703033,0,5,1990-10-22,2,2014-02-28,1701,"Salaria","Blenniidae","Blenniiformes","Teleostei","Osteichthyes","Chordata",37,1897,"native","Mediterranean and Black Sea","No",13,2,15,18.8,21.2
"636","Salmo salar",236,"Salmo",86798,"Linnaeus, 1758","Sasal_ub.jpg",76,6009,"fusiform / normal","O",0,1,1,1,"benthopelagic","WaterAssumed",45.37,150,"TL",7251,"very high",0,1,0,1,0,0,0,0,1,1,"commercial","never/rarely","never/rarely",1,"harmless","no special ability",1,"Amphihaline species, spending most of its life in freshwater (Ref. 51442). Occurs in lakes and rocky runs and pools of small to large rivers (Ref. 86798).  Some landlocked populations exist. Found in all rivers where temperature rises above 10° C for about 3 months per year and does not exceed 20° C for more than a few weeks in summer (Ref. 59043) (preferred temperatures 4-12°C). Juveniles may live in cold lakes in northern Europe (Ref. 59043). Parr (i.e. juveniles) are territorial and are found in the upper reaches of rivers and streams, in riffle areas with strong current and rough gravel bottoms (Ref. 7471). During winter, parr seek refuge in small spaces or under stones during the day (Refs. 59043, 89461). Young remain in freshwater for 1 to 6 years, then migrate to coastal marine waters or even to open oceans where they remain for 1 to 4 years before returning to freshwater  for spawning (Ref. 51442). Adults inhabit cooler waters with strong to moderate flow (Ref. 44894). The Atlantic salmon is reported to live up to 10 years, but most individuals only reach 4-6 years (Ref. 88187). Juveniles feed mainly on aquatic insects, mollusks, crustaceans and fish; adults at sea feed on squids, shrimps, and fish (Ref. 51442). Most populations depend mostly or exclusively on stocking due to degradations of environmental conditions.  Fishing pressure on wild stocks has decreased due to intensive farming but other problems have increased. Farmed salmons escape in large numbers and move to any river and hybridize with wild stocks (Ref. 59043). This species may hybridize with trout (Salmo trutta) (Ref. 59043). Diseases of the species include furunculosis (Aeromonas salmonicida), corynebacterial kidney disease (Renibacterium salmoninarum), enteric red mouth disease (Yersinia ruckeri), infectious pancreatic necrosis virus, bacterial kidney disease, fin rot and fungus infections (Ref. 5951). Marketed fresh, dried or salted, smoked, and frozen; eaten steamed, fried, broiled, cooked in microwave, and baked (Ref. 9988).",0.5,0,2,1990-10-17,10,2018-05-09,236,"Salmo","Salmonidae","Salmoniformes","Teleostei","Osteichthyes","Chordata",37,250,"native","Mediterranean and Black Sea","Yes",150,4.5,1.5,9.3,15.3
"637","Salmo trutta",238,"Salmo",4779,"Linnaeus, 1758","Satru_u2.jpg",76,6009,"fusiform / normal","R",0,1,1,1,"pelagic-neritic","WaterAssumed",56.26,140,"SL",682,"very high",0,1,0,1,0,0,0,0,1,0,"commercial","never/rarely","never/rarely",1,"potential pest","no special ability",1,"Found in streams, ponds, rivers and lakes (Ref. 5951).  Individuals spend 1 to 5 years in fresh water and 6 months to 5 years in salt water (Ref. 51442).  Juveniles mature in 3-4 years (Ref. 6885).  Lacustrine populations undertake migration to tributaries and lake outlets to spawn, rarely spawning on stone, wave-washed lake shores.  Spawns in rivers and streams with swift current, usually characterized by downward movement of water intro gravel (Ref. 59043).  Spawning takes place normally more than one time (Ref. 51442).  They prefer cold, well-oxygenated upland waters although their tolerance limits are lower than those of rainbow trout and favors large streams in the mountainous areas with adequate cover in the form of submerged rocks, undercut banks, and overhanging vegetation (Ref. 6465).  Life history and spawning behavior is similar to the salmon <i>Salmo salar</i> (Ref. 51442).  Each female produces about 10.000 eggs (Ref. 35388, Ref. 51442).  Mainly diurnal (Ref. 682).  Sea and lake trouts forage in pelagic and littoral habitats, while sea trouts mainly close to coast, not very far from estuary of natal river (Ref. 59043).  Juveniles feed mainly on aquatic and terrestrial insects; adults on mollusks, crustaceans and small fish (Ref. 26523, Ref. 51442).  Marketed fresh and smoked; eaten fried, broiled, boiled, cooked in microwave, and baked (Ref. 9988).",0.5,0,2,1990-10-17,10,2015-05-12,238,"Salmo","Salmonidae","Salmoniformes","Teleostei","Osteichthyes","Chordata",37,252,"native","Mediterranean and Black Sea","Yes",170.800003051758,3.35999989509583,6.5,10.1,15.8
"638","Sarda sarda",115,"Sarda",168,"(Bloch, 1793)","Sasar_u3.jpg",416,939,"fusiform / normal","R",0,0,1,1,"pelagic-neritic","WaterAssumed",32.68,91.4000015258789,"FL",168,"high",1,1,0,1,0,0,0,0,1,0,"never/rarely","never/rarely","never/rarely",1,"reports of ciguatera poisoning","no special ability",1,"Epipelagic, neritic and schooling species that may enter estuaries.  Known to be cannibalistic, adults prey on small schooling fishes, invertebrates like squid and shrimps and can swallow relatively large prey.  Eggs and larvae pelagic (Ref. 6769).  Utilized fresh, dried or salted, smoked, canned and frozen (Ref. 9987).  Able to adapt to different temperatures 12° to 27°C and salinities 14 to 39 (Ref. 36731).",0.531199991703033,0,2,1990-10-17,949,2008-09-10,115,"Sarda","Scombridae","Scombriformes","Teleostei","Osteichthyes","Chordata",37,129,"native","Mediterranean and Black Sea","No",101.449996948242,4.23000001907349,7,10.7,23.4
"639","Sardina pilchardus",1350,"Sardina",188,"(Walbaum, 1792)","Sapil_u6.jpg",796,7390,"fusiform / normal","R",0,1,1,1,"pelagic-neritic","WaterAssumed",30.31,27.5,"SL",74552,"low",1,1,0,1,0,1,0,0,0,1,"never/rarely","never/rarely","never/rarely",0,"harmless","no special ability",1,"Littoral species (Ref. 6808).   Form schools, usually at depths of 25 to 55 or even 100 m by day, rising to 10 to 35 m at night.  Feed mainly on planktonic crustaceans, also on larger organisms.  Spawn in batches (Ref. 51846), in the open sea or near the coast, producing 50,000-60,000 eggs with a mean diameter of 1.5 mm (Ref. 35388).  Marketed fresh, frozen or canned.  Also utilized dried or salted and smoked; can be pan-fried, broiled and microwaved (Ref. 9988).",1,0,3,1990-10-17,303,2013-07-15,1350,"Sardina","Alosidae","Clupeiformes","Teleostei","Osteichthyes","Chordata",37,1368,"native","Mediterranean and Black Sea","No",33.5499992370605,3.05999994277954,7.1,10.3,17.3
