"","Species","SpecCode.x","Genus.x","SpeciesRefNo","Author","PicPreferredName","FamCode","GenCode","BodyShapeI","Source","TaxIssue","Fresh","Brack","Saltwater","DemersPelag","AirBreathing","Vulnerability","Length","LTypeMaxM","MaxLengthRef","PriceCateg","MSeines","MGillnets","MCastnets","MTraps","MSpears","MTrawls","MDredges","MLiftnets","MHooksLines","MOther","UsedforAquaculture","UsedasBait","Aquarium","GameFish","Dangerous","Electrogenic","GoogleImage","Comments","PD50","Emblematic","Entered","DateEntered","Modified","DateModified","SpecCode.y","Genus.y","Family","Order","Class","SuperClass","Phylum","AreaCode","StockCode","Status","FAO","Invasive","MaxLengthTL","Troph","TempPrefMin","TempPrefMean","TempPrefMax"
"396","Lamna nasus",88,"Lamna",247,"(Bonnaterre, 1788)","Lanas_u2.jpg",9,616,"fusiform / normal","R",0,0,0,1,"pelagic-oceanic","WaterAssumed",74.1,350,"TL",4645,"medium",0,1,0,0,0,1,0,0,1,1,"never/rarely","never/rarely","never/rarely",1,"traumatogenic","electrosensing only",1,"Occurs inshore to offshore fishing banks and occasionally to open ocean areas. It is migratory, moves generally along the continental shelves (inshore to surface during simmer) and winters offshore in deeper water (Ref. 58085). Most abundant on continental offshore fishing banks but also found far from land in ocean basins and occasionally close inshore (Ref. 247). Extreme depth reported to 1,360 meters. Age attained in North Atlantic at least 26 years and in the Southern Hemisphere probably 65 years (Ref. 119696). Specimens tagged off southern England were recaptured in northern Norway (having travelled 2,370 km), Denmark and Spain (Ref. 88752, 88753). The northwest Atlantic stock migrates from Newfoundland, Canada in the winter to Massachusetts in the summer (Ref. 43278, 88754). Trans-Atlantic migrations have also been recorded. One of the most cold-tolerant sharks; in the northwest Atlantic mostly found from 5-10°C (Ref. 88755); with extremes of -1°C and 23°C (Ref. 119696). Known to temporarily tolerate salinities as low as 10 to follow its prey (Ref. 88740). Found singly and in schools and feeding aggregations (Ref. 247). Feeds on small and medium-sized pelagic schooling species, other sharks, squid (Ref. 5578) and demersal fishes (cod, white hake, red hake, haddock and cusk (Ref. 5951, 43278)). Ovoviviparous species (Ref. 43278, 50449). Females grow larger than males (Ref. 88756). Parasites include <i>Phyllobothrium dagnallium</i> (found in stomach, intestine and spiral valve) and <i>Dinobothrium</i> sp. (Ref. 5951). Regarded as potentially dangerous to people because of its size and activity but has never or very seldom been indicted in an attack on people or boats (Ref. 247). Considered by some as a sport fish (Ref. 84357). The flesh of the porbeagle is of good quality and texture and is said to taste like swordfish (Ref. 84357). Utilized fresh, dried or salted and frozen for human consumption; for oil and fishmeal; fins for shark-fin soup (Ref. 247). May be pan-fried and broiled (Ref. 9988). Catch records and studies in the northeast Atlantic show segregation by sex and size (Ref. 56108, 88756, 88757).",0.781300008296967,0,23,1992-06-15,14,2019-03-20,88,"Lamna","Lamnidae","Lamniformes","Elasmobranchii","Chondrichthyes","Chordata",37,52770,"native","Mediterranean and Black Sea","No",350,4.46000003814697,3.1,7.8,16.3
"398","Lampanyctus crocodilus",617,"Lampanyctus",3397,"(Risso, 1810)","Lacro_u0.jpg",167,5633,"elongated","O",0,0,0,1,"bathypelagic","WaterAssumed",26.6,30,"SL",4479,"high",0,0,0,0,0,0,0,0,0,0,"never/rarely","never/rarely","never/rarely",0,"harmless","no special ability",1,"High-oceanic, between 700-1,000 m during the day (with juveniles in the upper 200 m) and 45-250 m and 4000-1,000 m at night (Ref. 4479).  Depth range from 318-1192 m in the eastern Ionian Sea (Ref. 56504).  Epipelagic to bathypelagic, feeds on zooplankton (Ref. 58426).  Catches of lanternfishes off the west coast of South Africa:  1,134-42,560 mt (Ref. 5571).  Minimum depth from Ref. 58018.",0.5,0,5,1990-10-17,303,2019-03-08,617,"Lampanyctus","Myctophidae","Myctophiformes","Teleostei","Osteichthyes","Chordata",37,633,"native","Mediterranean and Black Sea","No",36.5999984741211,3.22000002861023,3.4,7.9,14.6
"399","Lampanyctus pusillus",623,"Lampanyctus",4479,"(Johnson, 1890)","Lapus_u0.jpg",167,5633,"elongated","R",0,0,0,1,"bathypelagic","WaterAssumed",10,4.30000019073486,"SL",4479,"high",0,0,0,0,0,0,0,0,0,0,"never/rarely","never/rarely","never/rarely",0,"harmless","no special ability",1,"High-oceanic, found between 425-850 m during the day and between 40-125 m at night (Ref. 4479).",0.5,0,5,1990-10-17,65,2013-07-15,623,"Lampanyctus","Myctophidae","Myctophiformes","Teleostei","Osteichthyes","Chordata",37,639,"native","Mediterranean and Black Sea","No",5.25,3.40000009536743,8.5,12.3,16.5
"400","Lampetra fluviatilis",4480,"Lampetra",3161,"(Linnaeus, 1758)","Laflu_u0.jpg",1,4178,"eel-like","R",0,1,1,1,"demersal","WaterAssumed",61.99,50,"TL",30578,"unknown",0,1,0,1,0,0,0,0,0,1,"never/rarely","usually","never/rarely",0,"poisonous to eat","electrosensing only",1,"In fresh waters, in rivers, brooks, and lakes.  Anadromous, but some populations are permanent freshwater residents (e.g. Lough Neagh, Northern Ireland (UK); Loch Lomond, Scotland (UK); lakes Ladoga and Onega, Russian Federation) (Ref. 89241).  Amphihaline species (Ref. 51442). Metamorphosis takes place at a length of about 13 cm and they migrate to the sea (Ref. 51442). Most river lampreys live 4-7 years and reach 30-35 cm length (Ref. 88187). Females grow larger than males (Ref. 58137).  Adults spend 1-2 years at sea, often along the coast or in estuaries (Ref. 59043). They live on hard bottoms or attached to larger fish like cod and herring (Ref. 88174).  Adults are parasitic, feeding on fishes by sucking their blood and afterwards consuming the flesh (Ref. 1998).  Adults predatory on marine fishes from the end of July to October.  Trematodes and cestodes have been found in the intestine of prespawning adults at sea. (Ref. 89241). In autumn, adults commonly undergo reproductive migration from the sea to shallow middle or upper reaches of rivers and streams with strong currents (1.0-2.0 m/s in British rivers) and gravel bottoms (Ref. 51442, 59043, 88171). Spawning migration upriver (Vistula and Neman rivers) begins near the end of September in the Baltic Sea Basin. In tributaries to the Gulf of Finland (Narva, Neva, and Luga rivers), upstream spawning migrations occur twice yearly; once in summer-fall and once in spring. In the upper Rhine River, the spawning season is February to April; in England (UK) from April to May; and in the lower Neva River, Russian Federation, from early June to early July (Ref. 89241).  During reproductive migration and reproduction, adults do not feed but instead utilize their lipid reserves (Ref. 30578) and are known to undergo a considerable shortening of up to 27 per cent (Ref. 83507).  Fecundity is highly variable and ranges from 650 to 42,500 eggs/female; 10,000-16,000 eggs/female in Lake Ladoga. Communal spawning in the same redd by <i>L. fluviatilis</i> and <i>L. planeri</i> has been reported in the River Tywi Basin, Wales (UK), in April, at a water temperature of 11 °C. Both species participated in constructing a redd about 23 cm in diameter and 5-8 cm deep, consisting of pebbles, gravel and coarse sand (Ref. 89241). Spawning takes place in pre-excavated pits in river beds, its depth between 50-100 cm; after spawning the adults die (Ref. 51442). The blind ammocoetes are filter feeders of detritus and microorganisms; they live mostly buried in sand, silt or clay sediments for up to 4.5 years, often at the edges of rivers and streams where currents are slow (Ref. 51442, 59043, 88184, 88185). Sometimes they are found in substrates with submerged vegetation and plant debris (Ref. 12285). Ammocoetes may tolerate low oxygen levels but when burrows reach near anoxic levels, the larvae need to emerge from the substrate in order to survive (Ref. 88184).  Fisheries exist in England (UK), Finland, France, and the Russian Federation. In the 19th century, up to 450,000 adults yearly were used by the English fishing fleet as bait in the fisheries for <i>Gadus morhua</i> and <i>Psetta maxima</i>. In Finland, the catch in 1983 was 2.3-2.4 million individuals (about 100 t) for a value of $800,000 US. There are reports of intoxication through eating this species (Halstead 1967). The mucus and serum are poisonous and the flesh must be thoroughly washed and all the blood removed before consumption (Ref. 5504). Cooking method involves de-sliming, removal of heads and branchial regions, the rest of the body covered in sunflower flour, and cooked in sunflower oil (Ref.89241). Utilized fresh and smoked; eaten fried (Ref. 9988).",0.500199973583221,0,3,1991-06-21,2,2014-04-28,4480,"Lampetra","Petromyzontidae","Petromyzontiformes","Petromyzonti","Agnatha","Chordata",37,4678,"native","Mediterranean and Black Sea","Yes",50,4.5,5.2,9.8,12.2
"401","Lampris guttatus",1072,"Lampris",6737,"(Brünnich, 1788)","Lagut_ua.jpg",222,4375,"short and / or deep","R",0,0,0,1,"bathypelagic","WaterAssumed",60,200,"TL",5188,"very high",1,0,0,0,0,1,0,0,1,0,"never/rarely","never/rarely","never/rarely",1,"harmless","no special ability",1,"Oceanic and apparently solitary (Ref. 6737).  Epi- and mesopelagic (Ref. 58302).  Feeds on midwater fishes and invertebrates, mainly squids (Ref. 6737).  Probably spawns in the spring (Ref. 6885).  Occasionally taken as a by-catch of tuna fisheries.  Considered a good food fish (Ref. 5242); marketed fresh and frozen; prepared as sashimi (Ref. 9987).  Swims by flapping the pectoral fins (Ref. 36731).",1,0,2,1990-10-17,949,2017-05-30,1072,"Lampris","Lampridae","Lampriformes","Teleostei","Osteichthyes","Chordata",37,1088,"native","Mediterranean and Black Sea","No",200,4.21999979019165,5,12.1,19.9
"402","Lappanella fasciata",22513,"Lappanella",4742,"(Cocco, 1833)","Lafas_u1.jpg",362,3351,"elongated","O",0,0,0,1,"reef-associated","WaterAssumed",10,15,"SL",50675,"very high",0,0,0,0,0,0,0,0,0,0,"never/rarely","never/rarely","never/rarely",0,"harmless","no special ability",1,"Found in deep rocky areas.  Feed on crabs, gastropods and polychaetes (Ref. 4742).",0.75,0,34,1996-04-26,1016,2009-07-02,22513,"Lappanella","Labridae","Eupercaria/misc","Teleostei","Osteichthyes","Chordata",37,17885,"native","Mediterranean and Black Sea","No",18.2999992370605,3.30999994277954,13.3,14.3,15.9
"403","Lebetus guilleti",459,"Lebetus",4696,"(Le Danois, 1913)","Lesco_u4.jpg",405,5715,"fusiform / normal","R",0,0,0,1,"reef-associated","WaterAssumed",10,2.5,"SL",35388,"very high",0,0,0,0,0,0,0,0,0,0,NA,NA,NA,0,"harmless","no special ability",1,"Found inshore on coarse ground, including coralline deposits (Ref. 4696).",0.75,0,2,1990-10-17,2,2011-01-27,459,"Lebetus","Gobiidae","Gobiiformes","Teleostei","Osteichthyes","Chordata",37,473,"native","Mediterranean and Black Sea","No",3.04999995231628,3.10999989509583,9.8,12.4,17.7
"404","Lebetus patzneri",69119,"Lebetus",121603,"Schliewen, Kovačić & Ordines, 2019",NA,405,5715,"elongated","O",NA,0,0,1,"reef-associated","WaterAssumed",10,1.67999994754791,"SL",121603,NA,0,0,0,0,0,0,0,0,0,0,"never/rarely","never/rarely","never/rarely",0,"harmless","no special ability",1,"Specimens were collected from a <i>Peyssonnelia</i> bed off the southern coast of Menorca (mainly <i>Peyssonnelia inamoena</i>), also with some presence of rhodolith forming species such as the coralline algae <i>Lithothamnion valens</i> and <i>Spongites fruticulosus</i>. The holotype was collected from a rhodolith bed in the Menorca Channel, with dominance of coralline red algae species, mainly <i>L. valens</i>, unidentified crustose coralline algae and <i>S. fruticulosus</i>. In the three sampling stations, the specimens were also accompanied by a large diversity of benthic animals (both sessile and mobile) with most abundant species including the decapods crustaceans <i>Inachus dorsettensis, Inachus thoracicus</i> and <i>Pagurus prideaux</i>; teleost fish <i>Buenia massutii, Odondebuenia balearica, Diplecogaster bimaculate</i> and <i>Serranus hepatus</i>; echinoderms <i>Sphaerechinus granularis, Ophiura albida</i> and <i>Echinaster sepositus</i>; annelids <i>Hyalinoecia tubicola</i> and <i>Laetmonice hystrix</i>; ascidians <i>Aplidium nordmanni, Ciona</i> spp. and <i>Ascidia mentula</i>; and, several unidentified sponge species (Ref. 121603).",NA,0,14,2020-06-22,2542,2020-06-22,69119,"Lebetus","Gobiidae","Gobiiformes","Teleostei","Osteichthyes","Chordata",37,60761,"native","Mediterranean and Black Sea","No",2.04999995231628,3.00999999046326,NA,NA,NA
"405","Lepadogaster candolii",640,"Lepadogaster",4765,"Risso, 1810","Lecan_m0.jpg",434,4080,"elongated","R",0,0,0,1,"demersal","Facultative",10,7.5,"SL",4489,"unknown",0,0,0,0,0,0,0,0,0,0,"never/rarely","never/rarely","never/rarely",0,"harmless","no special ability",1,"Occurs in the lower intertidal zone with the algae <i>Himanthalia</i> and <i>Laminaria</i> (Ref. 4489).",0.625,0,2,1990-10-17,113,2003-07-24,640,"Lepadogaster","Gobiesocidae","Gobiesociformes","Teleostei","Osteichthyes","Chordata",37,656,"native","Mediterranean and Black Sea","No",9.14999961853027,2.77999997138977,10.6,18.2,20.7
"406","Lepadogaster lepadogaster",643,"Lepadogaster",106293,"(Bonnaterre, 1788)","Lelep_u8.jpg",434,4080,"elongated","R",0,0,0,1,"demersal","Facultative",10,6.5,"SL",4765,"unknown",0,0,0,0,0,0,0,0,0,0,"never/rarely","never/rarely","commercial",0,"harmless","no special ability",1,"Intertidal species (Ref. 27000).",0.625,0,2,1990-10-17,113,2016-01-21,643,"Lepadogaster","Gobiesocidae","Gobiesociformes","Teleostei","Osteichthyes","Chordata",37,659,"native","Mediterranean and Black Sea","No",7.92999982833862,3.14000010490417,16.1,19,21.2
"407","Lepadogaster purpurea",16746,"Lepadogaster",106293,"(Bonnaterre, 1788)","Lelep_u7.jpg",434,4080,"elongated","R",0,0,0,1,"demersal","Facultative",10,7.5,"SL",4489,"unknown",0,0,0,0,0,0,0,0,0,0,"never/rarely","never/rarely","never/rarely",0,"harmless","no special ability",1,"Occurs on rocky, seaweed covered shores, particularly among small boulders.  Most common in the intertidal zone amongst the algae <i>Himanthalia</i> and <i>Laminaria</i> (Ref. 4489).",0.625,0,34,1996-02-29,113,2016-01-21,16746,"Lepadogaster","Gobiesocidae","Gobiesociformes","Teleostei","Osteichthyes","Chordata",37,15220,"native","Mediterranean and Black Sea","No",9.14999961853027,3.15000009536743,NA,NA,NA
"408","Lepidion guentheri",46282,"Lepidion",2729,"(Giglioli, 1880)","Legue_u1.jpg",180,2918,"elongated","O",0,0,0,1,"benthopelagic","WaterAssumed",59.53,81,"SL",4774,"medium",0,0,0,0,0,0,0,0,0,0,"never/rarely","never/rarely","never/rarely",0,"harmless","no special ability",1,NA,0.501999974250793,0,34,1998-02-12,949,2007-01-23,46282,"Lepidion","Moridae","Gadiformes","Teleostei","Osteichthyes","Chordata",37,39000,"native","Mediterranean and Black Sea","No",98.8199996948242,3.5699999332428,3.4,4.3,4.9
"409","Lepidion lepidion",2017,"Lepidion",109127,"(Risso, 1810)","Lelep_u0.gif",180,2918,"fusiform / normal","R",0,0,0,1,"bathypelagic","WaterAssumed",52.82,44,"TL",1371,"medium",0,0,0,0,0,0,0,0,1,0,"never/rarely","never/rarely","never/rarely",0,"harmless","no special ability",1,"Most abundant in waters deeper than 750 m and feeds mainly on benthic organismsm  crustaceans and also on polychaetes. Caught singly but also in aggregations of more than 100 individuals (Ref. 1371). Parasites of the species include trematodes, cestodes, nematodes, acanthocephalans and copepods; attached in the intestines, gills and fins (Ref. 5951). Minimum depth (Ref. 58426).",0.501999974250793,0,2,1990-11-10,14,2020-01-20,2017,"Lepidion","Moridae","Gadiformes","Teleostei","Osteichthyes","Chordata",37,2213,"endemic","Mediterranean and Black Sea","No",44,3.58999991416931,13,13.2,13.7
"410","Lepidopus caudatus",645,"Lepidopus",6181,"(Euphrasen, 1788)","Lecau_u2.jpg",415,2370,"eel-like","R",0,0,0,1,"benthopelagic","WaterAssumed",53.11,210,"TL",36731,"medium",0,0,0,0,0,0,0,0,1,0,"never/rarely","never/rarely","never/rarely",1,"harmless","no special ability",1,"Occur on continental shelf, along its edge and upper slope down to 400 m (600 m in Australia), usually over sandy and muddy bottoms from 100 to 250 m (over 300 m in Australia).  Depth range from 333-620 m in the eastern Ionian Sea (Ref. 56504).  Migrate into midwater at night.  Form schools; occasionally found inshore in upwelling of deep water when it appears at surface.  Feed on crustaceans, small squid and fish (Ref. 6768).  Eggs and larvae are pelagic (Ref. 6768).",0.515600025653839,0,5,1990-10-17,2448,2021-12-06,645,"Lepidopus","Trichiuridae","Scombriformes","Teleostei","Osteichthyes","Chordata",37,661,"native","Mediterranean and Black Sea","No",210,3.8199999332428,9.8,12.1,16
"411","Lepidorhombus boscii",27,"Lepidorhombus",6501,"(Risso, 1810)","Lebos_f0.jpg",515,5489,"fusiform / normal","R",0,0,0,1,"demersal","WaterAssumed",47.78,40,"SL",4703,"very high",0,0,0,0,0,1,0,0,0,0,"never/rarely","never/rarely","never/rarely",0,"harmless","no special ability",1,"Inhabits soft bottoms (Ref. 6501).",0.751999974250793,0,1,1990-10-17,393,2010-04-05,27,"Lepidorhombus","Scophthalmidae","Pleuronectiformes","Teleostei","Osteichthyes","Chordata",37,37,"native","Mediterranean and Black Sea","No",48.7999992370605,3.74000000953674,7.5,11.5,15.1
"412","Lepidorhombus whiffiagonis",28,"Lepidorhombus",6501,"(Walbaum, 1792)","Lewhi_u0.jpg",515,5489,"fusiform / normal","R",0,0,0,1,"bathydemersal","WaterAssumed",59.63,60,"TL",3397,"very high",0,0,0,0,0,1,0,0,0,0,"never/rarely","never/rarely","never/rarely",0,"harmless","no special ability",1,"Adults occur on soft bottoms.  Depth range from 100-400 m (Ref. 06302) and from 288-700 m in the eastern Ionian Sea (Ref. 56504).  Feed on small bottom-living fishes as well as squids and crustaceans (Ref. 4703).  Spawning occurs in deep waters off Iceland and west of the British Isles (Ref. 35388).",0.751999974250793,0,1,1990-10-17,2,2016-12-15,28,"Lepidorhombus","Scophthalmidae","Pleuronectiformes","Teleostei","Osteichthyes","Chordata",37,38,"native","Mediterranean and Black Sea","No",60,4.34000015258789,6.3,7.7,11.4
"413","Lepidotrigla cavillone",1722,"Lepidotrigla",3397,"(Lacepède, 1801)","Lecav_u1.jpg",266,9693,"fusiform / normal","O",0,0,0,1,"demersal","WaterAssumed",24.53,20,"TL",3397,"low",0,0,0,0,0,0,0,0,0,0,"never/rarely","never/rarely",NA,0,"harmless","no special ability",1,NA,0.5,0,5,1990-10-22,2447,2017-09-11,1722,"Lepidotrigla","Triglidae","Perciformes/Scorpaenoidei","Teleostei","Osteichthyes","Chordata",37,1918,"native","Mediterranean and Black Sea","No",20,3.32999992370605,13.3,15,16.4
"414","Lepidotrigla dieuzeidei",10186,"Lepidotrigla",3687,"Blanc & Hureau, 1973","Ledie_u0.jpg",266,9693,"fusiform / normal","R",0,0,0,1,"demersal","WaterAssumed",10,20,"TL",3397,"very high",0,0,0,0,0,1,0,0,0,0,NA,NA,NA,0,"harmless","no special ability",1,"Inhabits sandy and muddy bottoms (Ref. 3699).  Depth range from 60-250 m (Ref. 04697) and from 288-596 m in the eastern Ionian Sea (Ref. 56504).  Feeds on crustaceans, mainly amphipods (Ref. 4697).",0.5,0,34,1994-05-14,65,2013-07-18,10186,"Lepidotrigla","Triglidae","Perciformes/Scorpaenoidei","Teleostei","Osteichthyes","Chordata",37,10509,"native","Mediterranean and Black Sea","No",20,3.66000008583069,13.3,14.6,17.3
"415","Lestidiops jayakari",12415,"Lestidiops",4473,"(Boulenger, 1889)","Lejay_u1.gif",773,5963,"elongated","R",0,0,0,1,"bathypelagic","WaterAssumed",10,20,"TL",4056,"unknown",0,0,0,0,0,0,0,0,0,0,"never/rarely","never/rarely","never/rarely",0,"harmless","no special ability",1,"Epipelagic to bathypelagic, from 50 (larvae and juveniles (Ref. 47377)) to more than 2,000 m (older youngs and adults (Ref. 47377)) (Ref. 4056).",0.5,0,18,1994-08-18,65,2014-05-05,12415,"Lestidiops","Lestidiidae","Aulopiformes","Teleostei","Osteichthyes","Chordata",37,12744,"native","Mediterranean and Black Sea","No",20,4.23000001907349,6.9,9.9,14.6
"416","Lestidiops pseudosphyraenoides",1723,"Lestidiops",4473,"(Ege, 1918)",NA,773,5963,"Elongated","R",0,0,0,1,"pelagic-oceanic","WaterAssumed",10,9.5,"SL",4473,"unknown",0,0,0,0,0,0,0,0,0,0,"never/rarely","never/rarely","never/rarely",0,"harmless","no special ability",1,NA,0.5,0,5,1990-10-22,65,2021-10-29,1723,"Lestidiops","Lestidiidae","Aulopiformes","Teleostei","Osteichthyes","Chordata",37,1919,"native","Mediterranean and Black Sea","No",11.5900001525879,3.94000005722046,NA,NA,NA
"417","Lestidiops sphyrenoides",1724,"Lestidiops",3397,"(Risso, 1820)","Lesph_u0.gif",773,5963,"elongated","O",0,0,0,1,"bathypelagic","WaterAssumed",22.94,27,"SL",3397,"unknown",0,0,0,0,0,0,0,0,0,0,"never/rarely","never/rarely","never/rarely",0,"harmless","no special ability",1,"Epipelagic to mesopelagic, juveniles collected in the upper 400 m (Ref. 5759).  Presumably carnivorous (Ref. 5759).",0.5,0,5,1990-10-22,65,2013-07-18,1724,"Lestidiops","Lestidiidae","Aulopiformes","Teleostei","Osteichthyes","Chordata",37,1920,"native","Mediterranean and Black Sea","No",32.939998626709,4.5,13.1,14.2,15.7
"418","Lestidium atlanticum",10170,"Lestidium",4473,"Borodin, 1928","Leatl_u5.jpg",773,270,"elongated","F",0,0,0,1,"bathypelagic","WaterAssumed",15,25,"TL",4056,"unknown",0,0,0,0,0,0,0,0,0,0,"never/rarely","never/rarely","never/rarely",0,"harmless","no special ability",1,"Oceanic species (Ref. 26340) occurring from the surface (young) to about 1,000 m depth (Ref. 4473).",0.5625,0,34,1994-05-14,2291,2015-04-09,10170,"Lestidium","Lestidiidae","Aulopiformes","Teleostei","Osteichthyes","Chordata",37,10493,"native","Mediterranean and Black Sea","No",25,4.13000011444092,7.4,11.9,17.9
"419","Lesueurigobius friesii",7685,"Lesueurigobius",5299,"(Malm, 1874)","Lefri_u2.jpg",405,965,"elongated","R",0,0,0,1,"demersal","WaterAssumed",20.62,13,"TL",35388,"very high",0,0,0,0,0,0,0,0,0,0,"never/rarely","never/rarely","never/rarely",0,"harmless","no special ability",1,"Cryptobenthic, burrowing in muddy sand or mud; often associated with a decapod crustacean <i>Nephrops norvegicus</i> (Ref. 5299).  Feed on polychaetes, small crustaceans and mollusks (Ref. 4696).  Eggs are deposited in burrows (Ref. 35388).",0.531199991703033,0,18,1993-03-19,65,2021-07-22,7685,"Lesueurigobius","Gobiidae","Gobiiformes","Teleostei","Osteichthyes","Chordata",37,7994,"native","Mediterranean and Black Sea","No",13,3.35999989509583,7.2,10.4,18.4
"420","Lesueurigobius sanzi",22781,"Lesueurigobius",4696,"(de Buen, 1918)","Lesan_u0.gif",405,965,"fusiform / normal","O",0,0,0,1,"demersal","WaterAssumed",10,11,"TL",5299,"very high",0,0,0,0,0,0,0,0,0,0,"never/rarely","never/rarely","never/rarely",0,"harmless","no special ability",1,"Occurs offshore on muddy sand or mud (Ref. 5299).",0.531199991703033,0,34,1996-05-06,65,2013-07-15,22781,"Lesueurigobius","Gobiidae","Gobiiformes","Teleostei","Osteichthyes","Chordata",37,18073,"native","Mediterranean and Black Sea","No",11,3.32999992370605,15.3,17.1,18.7
"421","Lesueurigobius suerii",1798,"Lesueurigobius",4696,"(Risso, 1810)","Lesue_u0.jpg",405,965,"elongated","R",0,0,0,1,"demersal","WaterAssumed",10,7.5,"TL",53342,"very high",0,0,0,0,0,0,0,0,0,0,NA,NA,"commercial",0,"harmless","no special ability",1,"Found inshore (Ref. 4696). Up to depth of 230 m (Ref. 04696) but from 322-337 in the eastern Ionian Sea (Ref. 56504).",0.531199991703033,0,5,1990-10-25,65,2016-05-03,1798,"Lesueurigobius","Gobiidae","Gobiiformes","Teleostei","Osteichthyes","Chordata",37,1994,"native","Mediterranean and Black Sea","No",7.5,3.54999995231628,13.3,14.7,18
"422","Leucoraja circularis",7614,"Leucoraja",27314,"(Couch, 1838)","Lecir_u0.gif",19,3433,"other","R",0,0,0,1,"demersal","WaterAssumed",72,120,"TL",4426,"medium",0,0,0,0,0,0,0,0,0,0,"never/rarely","never/rarely","never/rarely",0,"harmless","weakly discharging",1,"Found in offshore shelf waters and on upper slope, mainly around the 100 m line (Ref. 3167).  Depth range from 70-275 m (Ref. 03167), and from 463-676 m in eastern Ionian Sea (Ref. 56504). Feed on all kinds of bottom animals (Ref. 3167).  Oviparous.  Distinct pairing with embrace.  Young may tend to follow large objects, such as their mother (Ref. 205).  Eggs are oblong capsules with stiff pointed horns at the corners deposited in sandy or muddy flats (Ref. 205).  Egg capsules are 8.3-9.2 cm long and 4.6-5.3 cm wide (Ref. 41303, 41251, 41311).  Maximum length for female is 117 cm (Ref. 41333).",0.5,0,18,1993-03-13,949,2021-10-15,7614,"Leucoraja","Rajidae","Rajiformes","Elasmobranchii","Chondrichthyes","Chordata",37,7918,"native","Mediterranean and Black Sea","No",120,3.5,7.5,11.3,14.2
"423","Leucoraja fullonica",7619,"Leucoraja",27314,"(Linnaeus, 1758)","Leful_m0.jpg",19,3433,"other","R",0,0,0,1,"bathydemersal","WaterAssumed",72,120,"TL",106604,"low",0,0,0,0,0,0,0,0,0,0,"never/rarely","never/rarely","never/rarely",0,"harmless","weakly discharging",1,"Found in relatively cold coastal waters and on upper parts of continental slopes (Ref. 3167).  Most common at depths of around 200 m, but deeper in southern areas (Ref. 3167).  Feed on all kinds of bottom animals, probably preferring fish (Ref. 3167).  Oviparous.  Distinct pairing with embrace.  Young may tend to follow large objects, such as their mother (Ref. 205).  Eggs are oblong capsules with stiff pointed horns at the corners deposited in sandy or muddy flats (Ref. 205).  Egg capsules are 7.5-9.9 cm long and 4.5-4.7 cm wide (Ref. 41250).  Maximum length for female is 111 cm (Ref. 41333).",0.5,0,18,1993-03-15,681,2021-10-15,7619,"Leucoraja","Rajidae","Rajiformes","Elasmobranchii","Chondrichthyes","Chordata",37,7923,"native","Mediterranean and Black Sea","No",120,3.5,6.8,9.5,14.5
